st2,GEOID,lake,lat,lon
VA,51121,"Tom's Creek Pond, Montgomery county ",37.2266412625672,-80.4945196365606
VA,51049,"Leon Hanson Pond, Cumberland county ",37.7380652041882,-78.1530585548616
VA,51105,"Middleton Lake, Lee county ",36.7584778409061,-83.1166363324412
VA,51101,"Huckleberry Pond, King William county ",37.7844331359562,-77.2587257910724
VA,51109,"Chisholm Lake, Louisa county ",37.9252788895136,-77.8189780079166
VA,51003,"Baileys Pond, Albemarle county ",38.0600094998648,-78.4447754738756
VA,51101,"Harrell Pond, King William county ",37.5727361550482,-76.9113532675421
VA,51127,"Cooks Millpond, New Kent county ",37.5283999004456,-76.9123160045888
VA,51127,"Taylor Pond, New Kent county ",37.4975984698609,-76.8237118202921
VA,51127,"Richardson Millpond, New Kent county ",37.4360355144045,-76.7913542187425
VA,51195,"3rd Hole Pond, Wise county ",36.9584247865866,-82.4449712881751
VA,51800,"C-Pond, Suffolk county ",36.5759091041332,-76.8767293857234
VA,51093,"Pond B-2, Isle of Wight county ",36.6509087243915,-76.9064072910638
VA,51003,"Lloyd Pond, Albemarle county ",37.9949035090329,-78.3276899538757
VA,51075,"Harris Pond, Goochland county ",37.8203835953998,-77.9599630172528
VA,51101,"Cohoke Millpond, King William county ",37.5829480209176,-76.9469732709618
VA,51033,"Caroline Pines Lake, Caroline county ",37.8910781159545,-77.4385360631823
VA,51800,"Norfleet Pond, Suffolk county ",36.6489175822842,-76.7105070916949
VA,51153,"Ralph's Pond, Prince William county ",38.6223198703841,-77.5433586325587
VA,51083,"Watson Pond, Halifax county ",36.6394792935814,-79.1741780577482
VA,51107,"Skallerup Pond, Loudoun county ",38.995989272165,-77.8682171137218
VA,51133,"Fallins Millpond, Northumberland county ",37.9464547400395,-76.5067021276044
VA,51133,"Falling Millpond, Northumberland county ",37.9447119719404,-76.5098724947712
VA,51025,"Harrisons Pond, Brunswick county ",36.9380122138706,-77.7397571427527
VA,51125,"Baldwin Pond, Nelson county ",38.0077290614336,-78.8492476289196
VA,51061,"Fleetwood Farm Pond Number One, Fauquier county ",38.9658075175298,-77.9371911159486
VA,51101,"Boshers Millpond, King William county ",37.7123625274317,-77.1419280865431
VA,51149,"Cerneys Pond, Prince George county ",37.2668165221339,-77.0163403972009
VA,51001,"Virginia Truck and Experimental Station Reservoir, Accomack county ",37.5859777148814,-75.8180446227791
VA,51049,"Doctor W B Blanton Pond, Cumberland county ",37.387355023453,-78.2466364690655
VA,51001,"Drummonds Millpond, Accomack county ",37.7679392053686,-75.6879702647277
VA,51800,"Scruggs Pond, Suffolk county ",36.7596544219804,-76.7069412798179
VA,51800,"Luter Pond, Suffolk county ",36.7215671072515,-76.6563764189491
VA,51800,"Sadler Pond, Suffolk county ",36.7656757178456,-76.5953485384022
VA,51800,"Issac Walton Lake, Suffolk county ",36.7888992188155,-76.6000229454307
VA,51800,"Beamon Pond, Suffolk county ",36.7555581022073,-76.5365343790559
VA,51093,"Courthouse Millpond, Isle of Wight county ",36.907122742412,-76.7100177884181
VA,51093,"Lake Burnt Mills, Isle of Wight county ",36.8497498831863,-76.6457869552413
VA,51179,"Henderson Lake, Stafford county ",38.3670696280302,-77.4322458011135
VA,51103,"Duntons Millpond, Lancaster county ",37.6806457405917,-76.3783172171284
VA,51083,"Wilkins Pond, Halifax county ",36.5819625705068,-79.0450293588432
VA,51163,"Cold Sulpher Springs Lake, Rockbridge county ",37.9754289097168,-79.5192003869345
VA,51003,"Stillfreds Pond, Albemarle county ",37.8081990801052,-78.543511183129
VA,51093,"Pond A-1, Isle of Wight county ",36.6669521658004,-76.9072359235575
VA,51033,"Lake De Jarnette, Caroline county ",37.8963158214267,-77.4442960784658
VA,51033,"Lake Pinewood, Caroline county ",37.8855021911688,-77.4334541476934
VA,51101,"Ballard Pond, King William county ",37.7882166971205,-77.2530715107122
VA,51101,"Mitchell Millpond, King William county ",37.8312321892389,-77.1671327054753
VA,51097,"Stevensville Pond, King and Queen county ",37.7388707742633,-76.9187262646343
VA,51007,"Beaver Pond, Amelia county ",37.2932199750507,-77.8910615887813
VA,51193,"Newtons Pond, Westmoreland county ",38.0569332828718,-76.6463494534777
VA,51061,"Hickory Tree Farm Lake, Fauquier county ",38.9358995495524,-77.7512257234234
VA,51037,"Roanoke Creek Site 4A Lake, Charlotte county ",37.1605124250118,-78.691936868805
VA,51049,"Atkins Pond, Cumberland county ",37.3545602326293,-78.3954984643287
VA,51049,"Wilcks Pond, Cumberland county ",37.3745966968137,-78.338414611843
VA,51163,"Lexington Reservoir, Rockbridge county ",37.7455449220701,-79.6487423993334
VA,51069,"High View Manor Lake, Frederick county ",39.163242477466,-78.3181825456339
VA,51069,"Lehmans Pond, Frederick county ",39.152844891794,-78.3069113993185
VA,51049,"Flippen Millpond, Cumberland county ",37.564524043199,-78.1559295459371
VA,51069,"Peacefull Valley Lake, Frederick county ",39.1454802805816,-78.3621430611208
VA,51069,"Seven Vistas Lake, Frederick county ",39.1129107105627,-78.3999933707074
VA,51187,"Warren Reservoir, Warren county ",38.9565992084828,-78.1484886099336
VA,51061,"Mellott Pond, Fauquier county ",38.8573508486502,-77.9030566594972
VA,51061,"Fox Pond, Fauquier county ",38.7801511403833,-77.7991602151226
VA,51061,"Bowmans Pond, Fauquier county ",38.8500958904568,-77.8266931169012
VA,51061,"Herbert Pond, Fauquier county ",38.9074949856521,-77.8878706779458
VA,51061,"Woodside Lake, Fauquier county ",38.9004445412357,-77.9014346367697
VA,51107,"Archbold Lake, Loudoun county ",39.024101604777,-77.8423254568577
VA,51107,"Rayborn Lake, Loudoun county ",39.0119939741787,-77.7758447674495
VA,51107,"Round Hill Reservoir, Loudoun county ",39.1497075370193,-77.8054597638166
VA,51107,"Kalnasy Pond, Loudoun county ",39.1558214448325,-77.6384391839687
VA,51107,"Woodall Pond, Loudoun county ",39.0176133381884,-77.6275621023518
VA,51003,"Chiles Pond, Albemarle county ",37.9538915787574,-78.7421975184679
VA,51193,"Latanes Pond, Westmoreland county ",38.193570453084,-76.9556806596224
VA,51029,"Sutherland Pond, Buckingham county ",37.6734806830434,-78.2905311394953
VA,51009,"Pleasantview Hunt Club Pond, Amherst county ",37.6229548171114,-79.2790803832339
VA,51095,"Lake Pasbehegh, James City county ",37.2408646276248,-76.8051012024479
VA,51137,"Taylors Pond, Orange county ",38.2362141054267,-78.0750475495787
VA,51065,"Cosner Lake, Fluvanna county ",37.932315918331,-78.1700060006089
VA,51065,"Linton Lake, Fluvanna county ",37.9285209751785,-78.1787063904832
VA,51003,"Stillfried Pond, Albemarle county ",37.8455080683656,-78.5152738657478
VA,51085,"Springfield Lake, Hanover county ",37.7493835003594,-77.7353684840658
VA,51059,"Piney Reservoir, Fairfax county ",38.7506720940942,-77.1483304038944
VA,51009,"Izaak Walton Pond, Amherst county ",37.5036735500469,-79.081511534447
VA,51081,"Emporia Reservoir, Greensville county ",36.6973449846235,-77.5681642304327
VA,51025,"Brunswick County Lake, Brunswick county ",36.7901111924769,-77.7371772525006
VA,51183,"Parsons Number Two Pond, Sussex county ",36.8938178031534,-77.562352044714
VA,51031,"American Legion Lake, Campbell county ",37.3336517112845,-79.2208969130448
VA,51181,"Sunken Meadow Pond, Surry county ",37.2120165518877,-76.9387984487569
VA,51003,"Allmans Pond, Albemarle county ",37.7952914235457,-78.5588352305213
VA,51009,"Mays Pond, Amherst county ",37.6678224232978,-79.1504174210907
VA,51125,"Davis Pond, Nelson county ",37.7293400216615,-78.8206347719788
VA,51193,"Kings Millpond, Westmoreland county ",38.0015801077158,-76.630807457054
VA,51053,"Winfields Millpond, Dinwiddie county ",36.9488931280623,-77.4994469135014
VA,51149,"Butterworth Pond, Prince George county ",37.0846502493266,-77.3884718858873
VA,51730,"Wilcox Lake, Petersburg county ",37.1985232514919,-77.4042862670154
VA,51570,"Swift Creek Lake, Colonial Heights county ",37.2725990790915,-77.4246362976356
VA,51085,"Parsleys Millpond, Hanover county ",37.6020103818449,-77.2251208576071
VA,51031,"Jones Pond, Campbell county ",37.2387050307333,-78.8838345842013
VA,51109,"Woolfolks Pond, Louisa county ",37.9938890128754,-77.9929767152101
VA,51109,"Yanceyville Millpond, Louisa county ",37.9380672725789,-77.9831396986815
VA,51109,"Byrd Millpond, Louisa county ",37.9882064854932,-78.0806220480922
VA,51109,"Meyerton Lake, Louisa county ",38.0961499530389,-78.0235757070529
VA,51109,"Ponda Roche Lake, Louisa county ",38.1196159790965,-78.1168727652021
VA,51079,"Harlow Farm Pond, Greene county ",38.1986766912518,-78.37758028152
VA,51079,"Reynolds Farm Pond, Greene county ",38.2149603774295,-78.3843097698804
VA,51079,"Word Farm Pond, Greene county ",38.2052749155173,-78.3590541465316
VA,51079,"Lake Skyline, Greene county ",38.2564804391213,-78.4325052653549
VA,51079,"Lake Shenandoah, Greene county ",38.252233823652,-78.4378207281879
VA,51079,"Lower Lake Shenandoah, Greene county ",38.2449957538327,-78.4411899118172
VA,51003,"Paines Lake, Albemarle county ",38.0943131356932,-78.4599819230571
VA,51003,"Red Hill Orchard Lake, Albemarle county ",37.9477966932629,-78.6071553848488
VA,51003,"Sego Pond, Albemarle county ",37.9830551204011,-78.663875633454
VA,51003,"Ruddocks Pond, Albemarle county ",37.9164240005775,-78.6976404040136
VA,51003,"Vanclieffs Lake, Albemarle county ",37.8442160760729,-78.6054284391454
VA,51075,"Bolling Hall Lake, Goochland county ",37.6681803831047,-77.966995836911
VA,51073,"Weaver Pond, Gloucester county ",37.3664713074201,-76.6043322189765
VA,51073,"Leigh Pond, Gloucester county ",37.3792139740288,-76.6058594264572
VA,51073,"Robins Pond, Gloucester county ",37.3723776685245,-76.5103768868961
VA,51195,"Coeburn Lake, Wise county ",36.977448720975,-82.4142981967618
VA,51073,"Cow Creek Pond, Gloucester county ",37.4339936612504,-76.4946302251758
VA,51143,"Deer Wood Springs Lake, Pittsylvania county ",36.7163197072926,-79.3835756585042
VA,51025,"Masons Mill Pond, Brunswick county ",36.9200058929641,-77.8902858843874
VA,51093,"Slade Pond, Isle of Wight county ",37.0538746047977,-76.7012410543811
VA,51085,"Jones Lake, Hanover county ",37.8089020314475,-77.5955097826072
VA,51073,"South Pond, Gloucester county ",37.5429083851525,-76.6013904126307
VA,51001,"Wallops Pond, Accomack county ",37.9328716430783,-75.4921028447934
VA,51001,"Tankard Pond, Accomack county ",37.6567169146807,-75.7845915663207
VA,51001,"Custis Pond, Accomack county ",37.6174136577205,-75.8502729986383
VA,51001,"Duer Pond, Accomack county ",37.5840088412257,-75.8308259630889
VA,51131,"Kellam Pond, Northampton county ",37.369970654985,-75.9798080212127
VA,51131,"Smith Pond, Northampton county ",37.360687984781,-75.9860605597911
VA,51185,"Sportsman Club Lake, Tazewell county ",37.1267350542021,-81.3808245904886
VA,51163,"Lake Robertson, Rockbridge county ",37.803302687179,-79.6078384448087
VA,51193,"Chrystal Lake, Westmoreland county ",38.1985158480758,-76.9883193757408
VA,51193,"Placid Lake, Westmoreland county ",38.2000812497101,-76.9806168467202
VA,51193,"Potomac Mills Pond, Westmoreland county ",38.160222209464,-76.945090044727
VA,51193,"Morris Pond, Westmoreland county ",38.1666954841112,-76.9359461600052
VA,51193,"Thomas Branch Pond, Westmoreland county ",38.153331429819,-76.9028402616976
VA,51085,"Flanagans Millpond, Hanover county ",37.6183417732247,-77.1799474690122
VA,51101,"Old Town Farm Pond, King William county ",37.5916129261067,-77.0008004380801
VA,51013,"Poplar Pond, Arlington county ",38.860167180515,-77.1221980875467
VA,51153,"Camp Upshur Pond, Prince William county ",38.6129428965266,-77.5431108703126
VA,51125,"Hamilton Lake, Nelson county ",37.8668336102821,-78.8608064488886
VA,51195,"Back Creek Lake, Wise county ",36.9685091955281,-82.6817992580615
VA,51195,"Rimrock Lake, Wise county ",36.9128109977326,-82.6889616874193
VA,51167,"Mountain Lake, Russell county ",36.8525832259934,-82.3765475674083
VA,51179,"R-6 Pond, Stafford county ",38.5133271505476,-77.5275098678562
VA,51061,"Miller Lake, Fauquier county ",38.7152613689497,-77.8796598786191
VA,51125,"Lake Monocan, Nelson county ",37.9042913265945,-78.8711840438009
VA,51075,"Bonneys Pond, Goochland county ",37.7849781305256,-78.0555097110237
VA,51041,"Moore Lake, Chesterfield county ",37.3611519096546,-77.4072862426672
VA,51095,"Warburton Pond, James City county ",37.2852714370433,-76.8205303035163
VA,51065,"Obrien Pond, Fluvanna county ",37.7139964634471,-78.2774694778101
VA,51003,"Firefly Pond, Albemarle county ",38.0460962640073,-78.5405455145626
VA,51015,"Lower Sherando Lake, Augusta county ",37.9231218930463,-79.0038328714193
VA,51041,"Falling Creek Reservoir, Chesterfield county ",37.4593810447551,-77.4785202768566
VA,51005,"Pond Lick Branch Reservoir, Alleghany county ",37.7337087929024,-80.0282984170213
VA,51157,"Lake Wilson, Rappahannock county ",38.71651779994,-78.0044747951944
VA,51029,"Paynes Millpond, Buckingham county ",37.7354750414062,-78.5153452704979
VA,51093,"Branch and Joyner Millpond, Isle of Wight county ",36.8288055368049,-76.6840133601675
VA,51067,"Burdettes Pond, Franklin county ",36.9435311784852,-80.1755142322966
VA,51153,"Aldred Pond, Prince William county ",38.8808577671115,-77.6516039206824
VA,51041,"Ruffins Pond, Chesterfield county ",37.3203391525711,-77.3718697743728
VA,51181,"Eastover Pond, Surry county ",37.1837747456553,-76.9040547162675
VA,51015,"Green Pond, Augusta county ",37.9408982901972,-79.0524286170597
VA,51185,"Tazewell Reservoir, Tazewell county ",37.1520471127682,-81.4139929759151
VA,51029,"Bradshaw Pond, Buckingham county ",37.6071767617461,-78.5983946948929
VA,51087,"Valley Mill Pond, Henrico county ",37.4445255535688,-77.2838692129166
VA,51031,"Silver Spring Lake, Campbell county ",37.3736296339727,-79.0896496165362
VA,51041,"Pells Pond, Chesterfield county ",37.2878851422552,-77.4918604786555
VA,51049,"T Edward Stimpson Pond, Cumberland county ",37.3907823359694,-78.3416927026559
VA,51075,"Lake Killerney, Goochland county ",37.8334009879359,-77.9763590332074
VA,51133,"Sydnors Millpond, Northumberland county ",37.9082884411368,-76.3860516998868
VA,51045,"McDaniels Lake, Craig county ",37.4005876343248,-80.4322469049335
VA,51009,"Elon Water Works Reservoir, Amherst county ",37.4939293268087,-79.1670175841528
VA,51029,"Dillwyn Lake, Buckingham county ",37.5510117700585,-78.4323824380139
VA,51015,"Nders Pond, Augusta county ",38.1521760081789,-79.2307525778641
VA,51109,"Orchid Lake, Louisa county ",37.8333576413589,-77.9117814592278
VA,51193,"Weavers Millpond, Westmoreland county ",38.0994416121786,-76.7750432250704
VA,51095,"Lake Norvell, James City county ",37.3849309384236,-76.6839113239264
VA,51181,"Gray Pond, Surry county ",37.1870734993471,-77.0109940016788
VA,51135,"Hobbs Millpond, Nottoway county ",37.1600945025778,-77.8580925592719
VA,51007,"Anderson Pond, Amelia county ",37.4270170080341,-77.9838358150867
VA,51015,"Walace Lake, Augusta county ",38.0005487358414,-79.1427396950592
VA,51157,"Margolis Pond, Rappahannock county ",38.6839606733701,-78.1515593755204
VA,51003,"Hallock Pond, Albemarle county ",38.0391185126856,-78.364546268646
VA,51041,"Gills Pond, Chesterfield county ",37.2737290326367,-77.5244487040837
VA,51065,"McIver Lake, Fluvanna county ",37.7271862056702,-78.2867984906645
VA,51171,"Old Woodstock Reservoir, Shenandoah county ",38.8454413623656,-78.4857147316809
VA,51075,"Pruitts Pond, Goochland county ",37.787726052768,-77.9757646937093
VA,51185,"Falls Mills Lake, Tazewell county ",37.2681932608753,-81.3282770884113
VA,51149,"Whelans Pond, Prince George county ",37.2039417642742,-77.0629233356824
VA,51065,"Bowles Pond, Fluvanna county ",37.8660238665531,-78.0901150657503
VA,51109,"Bearden Pond, Louisa county ",37.9668979532639,-77.8210743968872
VA,51165,"Cold Spring Pond, Rockingham county ",38.6754289183045,-78.7696632124457
VA,51049,"Garrett Lake, Cumberland county ",37.4845856168089,-78.2228701000959
VA,51015,"Smith Lake, Augusta county ",38.1145436719759,-78.9463588865801
VA,51125,"Payne Pond, Nelson county ",37.7415019379042,-78.8685664949622
VA,51109,"Sherman Lake, Louisa county ",37.9750466199873,-77.8305126876675
VA,51015,"South River Number 26 Dam, Augusta county ",38.0147185028609,-78.9222171608453
VA,51015,"South River Number 23 Dam, Augusta county ",38.0039158028218,-78.9191291870864
VA,51015,"Happy Hollow Lake, Augusta county ",37.9970348348148,-78.9374714102461
VA,51079,"Pruess Farm Pond, Greene county ",38.3447051651005,-78.4343241360177
VA,51029,"Walton Lake, Buckingham county ",37.6225989517739,-78.621059391028
VA,51193,"Lake Independence, Westmoreland county ",38.1618906236479,-76.7903526244522
VA,51133,"Courtney Millpond, Northumberland county ",37.9969788822263,-76.5750149186346
VA,51133,"Downings Millpond, Northumberland county ",37.9350187076872,-76.41650613114
VA,51061,"Echo Lake, Fauquier county ",38.788294411124,-77.7244719470269
VA,51061,"Silbersiepe Pond, Fauquier county ",38.7109549040548,-77.7126494450968
VA,51185,"Bishop Prep Plant Slurry Impoundment, Tazewell county ",37.1956581433702,-81.5780106416548
VA,51007,"Bardens Pond, Amelia county ",37.4194546713034,-78.0378429065069
VA,51087,"Bryant Pond, Henrico county ",37.57791316057,-77.5741322923039
VA,51187,"Sullivan Lake, Warren county ",38.875845114114,-78.2261821997364
VA,51029,"East Ridge Pond, Buckingham county ",37.4690410681096,-78.4383302475098
VA,51820,"Baker Springs Basin, Waynesboro county ",38.0587540840369,-78.8924827224425
VA,51041,"Kcratchs Pond, Chesterfield county ",37.3311835187715,-77.6506775954854
VA,51087,"Shadow Pond, Henrico county ",37.5724229882597,-77.564397423574
VA,51041,"Crostick Millpond, Chesterfield county ",37.3236448400858,-77.55445269782
VA,51053,"Eades Pond, Dinwiddie county ",37.2030961433334,-77.7000758659421
VA,51149,"Manns Pond, Prince George county ",37.1909075489059,-77.1114959074413
VA,51093,"Murphys Millpond, Isle of Wight county ",36.8537392702199,-76.6655024051079
VA,51041,"Licking Creek Fishing Club Lake, Chesterfield county ",37.4319215413014,-77.5397644557953
VA,51163,"Willow Lake, Rockbridge county ",37.9176671929395,-79.235257004031
VA,51125,"Ramsay Knox Pond, Nelson county ",37.7316318022718,-78.7085374254754
VA,51003,"Aldrich Pond, Albemarle county ",38.1684998076207,-78.3731257079348
VA,51049,"Fleming Lake, Cumberland county ",37.5158799768891,-78.1831119258228
VA,51061,"Brick House Lake, Fauquier county ",38.9547882241073,-77.8640162053365
VA,51031,"Concord Lake, Campbell county ",37.346913327434,-78.9853660662169
VA,51075,"Licking Hole Farm Pond, Goochland county ",37.6891452579208,-77.9921556782939
VA,51003,"Happy Creek Lake, Albemarle county ",38.1351642178001,-78.2355751196663
VA,51007,"Big Pond, Amelia county ",37.2970417841492,-77.9975959963411
VA,51079,"Wildwood Valley Lake, Greene county ",38.263036988935,-78.4324434925577
VA,51131,"Costin Pond, Northampton county ",37.2243178926242,-76.0084939160868
VA,51041,"Nash Road Lake, Chesterfield county ",37.3555836950914,-77.5456953799748
VA,51095,"Lake Powell, James City county ",37.2354293921265,-76.7444498942625
VA,51009,"Colemans Fall Reservoir, Amherst county ",37.514101746006,-79.3260509898839
VA,51019,"Reusens Reservoir, Bedford county ",37.4885171470257,-79.218037414816
VA,51031,"Lynch Lake, Campbell county ",37.2442649460003,-79.0856579150458
VA,51165,"Shenandoah Reservoir, Rockingham county ",38.4760149563758,-78.6213839154545
VA,51660,"Newman Lake, Harrisonburg county ",38.4332592307562,-78.8749550504932
VA,51109,"Sheltons Millpond, Louisa county ",37.7927489643419,-77.832146172961
VA,51171,"Chapman Reservoir, Shenandoah county ",38.8444858465899,-78.4938913739975
VA,51107,"Gordon Pond, Loudoun county ",39.290121733684,-77.7384963181406
VA,51107,"Wortman Pond, Loudoun county ",39.292589806288,-77.7269407778838
VA,51035,"Byllesby Reservoir, Carroll county ",36.7703735217941,-80.9424554591879
VA,51035,"Buck Reservoir, Carroll county ",36.806888621623,-80.9291270605088
VA,51077,"Fries Reservoir, Grayson county ",36.7091776874675,-80.9944297131458
VA,51181,"Sunken Meadow Creek, Surry county ",37.2189557030675,-76.9340827064899
VA,51177,"Hunting Run Reservoir, Spotsylvania county ",38.3441959000382,-77.6478131578199
VA,51193,"Rock Spring Pond, Westmoreland county ",38.1644056160033,-76.8761745621781
VA,51191,"Old mine filled, Washington county ",36.6796854690036,-81.7405700043276
VA,51093,"Gee Pond, Isle of Wight county ",36.9263633294723,-76.5942548990856
VA,51093,"Ava Pond, Isle of Wight county ",36.9264025426181,-76.5897570564772
VA,51093,"Cat Ponds, Isle of Wight county ",36.8918908895873,-76.5900814734752
VA,51173,"Sugar Hollow Pond, Smyth county ",36.7631101085171,-81.3795757994958
VA,51550,"Peanut Pond, Chesapeake county ",36.5952736815554,-76.285915619941
VA,51550,"South Pond, Chesapeake county ",36.594692916775,-76.2862299979267
VA,51093,"Smithfield Lake, Isle of Wight county ",36.9745517172424,-76.6684009243254
VA,51009,"Cushaw Reservoir, Amherst county ",37.598941745565,-79.3935918725355
VA,51107,"Romulus, Loudoun county ",38.9343594903265,-77.5895823379667
VA,51107,"Lake Verlin, Loudoun county ",38.9961722774427,-77.4877875633687
VA,51163,"The Ol' Swimming Hole, Rockbridge county ",37.6143088923014,-79.4876987291213
VA,51163,"Fishing Lake, Rockbridge county ",37.6134190322245,-79.4883199313397
VA,51059,"Flood control area, Fairfax county ",38.8958045186262,-77.4183611687505
VA,51059,"Cub Run, Fairfax county ",38.8622615929666,-77.478579265393
VA,51059,"Pond Hole 3 L, Fairfax county ",38.7958696125023,-77.4267066589301
VA,51059,"Pond Hole 3 Back, Fairfax county ",38.7955649246561,-77.427751882438
VA,51003,"Lake, Albemarle county ",38.1284944918233,-78.4270077818188
VA,51137,"Lake Of The Woods Number Two, Orange county ",38.3306663370193,-77.7408528661972
VA,51137,"Lake Of The Woods, Orange county ",38.3380747602399,-77.7628011370551
VA,51059,"Difficult Run, Fairfax county ",38.9743058294279,-77.2586987728182
VA,51009,"Bedford Municipal Lake, Amherst county ",37.5843707140088,-79.3796965733304
VA,51013,"Rain Garden, Arlington county ",38.9052309902114,-77.1260583234668
VA,51005,"Beaver Lake, Alleghany county ",37.6661360383508,-80.2334668606589
VA,51093,"Edwards Pond, Isle of Wight county ",36.9257449942577,-76.6300544812165
VA,51185,"Creek, Tazewell county ",37.105032326463,-81.6270626450377
VA,51107,"Lake Wilson, Loudoun county ",38.9956444899258,-77.4971632925535
VA,51059,"Pohick Bay, Fairfax county ",38.6820858179966,-77.1762640105713
VA,51059,"Massey Creek, Fairfax county ",38.6620196795568,-77.2231795132549
VA,51131,"Whites Pond, Northampton county ",37.2912994766927,-75.9739808884475
VA,51810,"Beverly Pond, Virginia Beach county ",36.8702925379317,-76.1872856347629
VA,51009,"Sheppe Pond, Amherst county ",37.6122253454662,-79.3855973138855
VA,51019,"Mirror Lake, Bedford county ",37.4542667430689,-79.2497218763771
VA,51191,"Whitetop Laurel Creek, Washington county ",36.6246041375161,-81.7592462451719
VA,51107,"Luhrs Lake, Loudoun county ",39.1637431278466,-77.7185695921157
VA,51093,"Aberdeen Pond, Isle of Wight county ",37.0268943179117,-76.5955252750534
VA,51093,"Lake Tormentor, Isle of Wight county ",37.0228046392533,-76.6131307112825
VA,51700,"The Mariners' Lake, Newport News county ",37.0513132828426,-76.4834302768576
VA,51015,"Stark Pond, Augusta county ",38.3606072393649,-79.2755826445792
VA,51165,"Blue Hole, Rockingham county ",38.7563650483957,-78.9385822699664
VA,51187,"Ennis Pond, Warren county ",38.9287728263076,-78.0941206571873
VA,51059,"Kaufman Pond, Fairfax county ",38.7733629895963,-77.3943333698167
VA,51067,"Smith Mountain Lake, Franklin county ",37.0753677832043,-79.6360855703338
VA,51059,"SWM-4, Fairfax county ",38.7663040197874,-77.1707765337677
VA,51199,"Harwoods Mill Resevoir, York county ",37.1456812444981,-76.4712483514869
VA,51041,"Rieves Lake, Chesterfield county ",37.3426340499365,-77.449963498471
VA,51740,"Lake Kingman, Portsmouth county ",36.8678029649113,-76.3519098871011
VA,51145,"Upper Byers Lake, Powhatan county ",37.5639530079471,-77.8262440727799
VA,51071,"Horton's Pond, Giles county ",37.3770430633194,-80.5222574830706
VA,51107,"Forest Manor Community Rain Water Basin, Loudoun county ",38.9918331257471,-77.5200151813389
VA,51800,"Butler Lake, Suffolk county ",36.8679232858652,-76.5704371740225
VA,51800,"Crystal Lake, Suffolk county ",36.8627189225364,-76.5695303104299
VA,51015,"Smithleigh Lake, Augusta county ",38.1524332869355,-79.2147181112898
VA,51187,"Willow Lake, Warren county ",38.9578807475954,-78.227504871827
VA,51187,"Wood Heaven Lake, Warren county ",38.9589145223542,-78.2296667579577
VA,51061,"Champ's Pond, Fauquier county ",38.8046309615009,-77.7149959980088
VA,51001,"Storm Water Pond, Accomack county ",37.9257538040266,-75.5537468567633
VA,51139,"Lake Arrowhead, Page county ",38.6408338925299,-78.3888646206288
VA,51059,"Brookfield Pond, Fairfax county ",38.7881929332392,-77.2008324405087
VA,51830,"Lake Matoaka, Williamsburg county ",37.267996493686,-76.724169674165
VA,51075,"Grandview Church Pond, Goochland county ",37.692969969031,-78.0361043900102
VA,51087,"Retention Pond, Henrico county ",37.6616378276482,-77.5850296644574
VA,51009,"Tusculum Lake, Amherst county ",37.6326694176662,-79.0047399678768
VA,51009,"Jones Pond, Amherst county ",37.6401266579944,-78.9910601365274
VA,51013,"Ballston Wetland, Arlington county ",38.8831724589369,-77.1191694592364
VA,51800,"Mathews Lake, Suffolk county ",36.8840141029551,-76.4229785455852
VA,51047,"Brandy Rock Farm Lake, Culpeper county ",38.5422928102934,-77.9032566640718
VA,51137,"Twin Lake, Orange county ",38.3566945862543,-77.761204813754
VA,51041,"Girl Scout Lake, Chesterfield county ",37.5232402536073,-77.5843425218355
