st2,GEOID,lake,lat,lon
SC,45063,Brooker Pond at Lexington county ,33.7286500176176,-81.1660936973443
SC,45017,Boozer Lower Pond at Calhoun county ,33.8171157421668,-81.007033014893
SC,45017,Boozer Upper Pond at Calhoun county ,33.8155650414401,-81.0125990380685
SC,45063,Silver Lake at Lexington county ,33.8809747817266,-81.0484389938209
SC,45017,Carolina Eastman Waste Pond at Calhoun county ,33.8600227690659,-81.0040350305898
SC,45017,Jamison Pond at Calhoun county ,33.8158554864687,-80.994921993464
SC,45079,Sunset Lake at Richland county ,33.8781080925893,-80.9215286551855
SC,45017,Wannamakers Upper I-26 Pond at Calhoun county ,33.7209071889187,-80.911592094695
SC,45017,Otts Pond at Calhoun county ,33.713775002377,-80.9347049041806
SC,45017,Smiths Falls Pond at Calhoun county ,33.720186228205,-80.9692353369714
SC,45017,Rast Pond at Calhoun county ,33.7214704380605,-80.9657525510561
SC,45017,Strawberry Pond at Calhoun county ,33.7113648423348,-80.986198295131
SC,45017,Powerline Pond at Calhoun county ,33.7074325596266,-80.9911094164752
SC,45017,Morefield Pond at Calhoun county ,33.6955712306577,-80.9915203089503
SC,45017,Davis Pond at Calhoun county ,33.7100966154246,-81.0042074079116
SC,45075,Granger Pond at Orangeburg county ,33.6892080514917,-81.0482996816334
SC,45017,Culclosure Pond at Calhoun county ,33.7279514268578,-80.9482073497337
SC,45017,Crowder Pond at Calhoun county ,33.7385362039473,-80.9159920609558
SC,45017,Sweetwater Lake at Calhoun county ,33.726175454834,-80.8964337904949
SC,45017,Doodle Hill Pond at Calhoun county ,33.7013321587185,-80.8463191418893
SC,45017,Raysors Lake at Calhoun county ,33.7010691301912,-80.8300963413994
SC,45017,Rileys Millpond at Calhoun county ,33.6975196073277,-80.8158723870684
SC,45017,Bensons Pond at Calhoun county ,33.7098790547711,-80.8032945479931
SC,45017,Lake Helen at Calhoun county ,33.7147133605454,-80.8220631950358
SC,45017,Taylors Upper Pond at Calhoun county ,33.8031937139128,-80.9792161787917
SC,45013,Fern Lakes at Beaufort county ,32.2365094015569,-80.8446457992767
SC,45017,Acres Pond at Calhoun county ,33.8472747165505,-81.0286164742726
SC,45017,Sikes Pond at Calhoun county ,33.7591883243067,-80.8305235752475
SC,45017,Strickland Pond at Calhoun county ,33.7235559878418,-80.792555337568
SC,45017,Buycls Swamp Pond at Calhoun county ,33.7120131277284,-80.7776854096495
SC,45017,Shehane Cabin Pond at Calhoun county ,33.6687924570487,-80.6548999052482
SC,45063,Goodwin Pond at Lexington county ,33.831076060811,-81.1358988387479
SC,45021,Lake Cherokee at Cherokee county ,35.0426701941506,-81.5758877754504
SC,45027,Harvin Pond at Clarendon county ,33.7308142991067,-80.2383591612422
SC,45017,Hills Number Two Pond at Calhoun county ,33.8175377701806,-81.0255323127475
SC,45017,Hill Number One Pond at Calhoun county ,33.8138440698132,-81.0272998164352
SC,45063,Carroll Pond at Lexington county ,33.8842206227317,-81.2337420495164
SC,45017,Green Pond at Calhoun county ,33.6152616842931,-80.8124978431407
SC,45017,Holman Pond at Calhoun county ,33.6293253599287,-80.6770917175233
SC,45063,Gantts Pond at Lexington county ,33.7443409969362,-81.3296989320226
SC,45003,Collums Pond at Aiken county ,33.7717520294415,-81.4957353881349
SC,45017,Lackland Pond at Calhoun county ,33.7758398310503,-81.0242323998488
SC,45017,Sulton Pond at Calhoun county ,33.7693780406998,-81.0314604176227
SC,45079,Wilson Mill Pond at Richland county ,34.0005322863206,-80.7463759353962
SC,45079,Odom Pond at Richland county ,34.0501633761802,-80.7558814063268
SC,45057,Fishing Creek Reservoir at Lancaster county ,34.639279373667,-80.8885109792731
SC,45081,Fricks Pond at Saluda county ,33.8850683353252,-81.5800076560153
SC,45063,Davis Pond at Lexington county ,33.8756961976666,-81.5447310533314
SC,45079,Carolina Patriots of the American Revolution Fountain at Richland county ,33.9986335033569,-81.0300681433467
SC,45017,Whetstone Pond at Calhoun county ,33.6180542509083,-80.7300562365696
SC,45003,Clarkes Lake at Aiken county ,33.3354261603648,-81.8966652755633
SC,45017,Wannamakers Pond at Calhoun county ,33.6379508662964,-80.7556038788275
SC,45079,Keenan Fountain at Richland county ,34.005433028305,-81.035702823628
SC,45013,Jarvis Creek Park Lake at Beaufort county ,32.2134864981204,-80.7358978388282
SC,45017,Taylors House Pond at Calhoun county ,33.8067080893887,-80.9821360806585
SC,45019,Drainage Pond at Charleston county ,32.8567263169975,-79.9620527827555
SC,45077,Big Rock Lake at Pickens county ,34.954599171689,-82.7850258719876
SC,45003,Cedar Lake at Aiken county ,33.5494420726888,-81.5384426244887
SC,45003,Cedar Pond at Aiken county ,33.6568335873248,-81.4825906315591
SC,45017,Sykes Pond at Calhoun county ,33.6270461890448,-80.7502394783453
SC,45077,Lake Diana at Pickens county ,34.9217180882415,-82.8666554066701
SC,45075,Williamson's Pond at Orangeburg county ,33.4496931672734,-81.1046983783299
SC,45007,Woodson Pond at Anderson county ,34.7597308744457,-82.4630776286369
SC,45007,Brushy Creek Watershed 16 Lake at Anderson county ,34.7865411852899,-82.521031087281
SC,45017,Crim Pond at Calhoun county ,33.6914837562572,-80.8752370457878
SC,45017,Gressett House Pond at Calhoun county ,33.6810353115724,-80.9011741002784
SC,45017,Bobby Gressett Pond at Calhoun county ,33.6279187461972,-80.8147032769672
SC,45017,Beckhams Pond at Calhoun county ,33.6314626942976,-80.8233920679135
SC,45079,Caughmans Pond at Richland county ,33.9942224047156,-80.7683813410719
SC,45077,Pinnacle Lake at Pickens county ,35.0289449704126,-82.6977055814212
SC,45045,North Saluda Reservoir at Greenville county ,35.151822029468,-82.395917764835
SC,45055,Macdonald Willetts Pond at Kershaw county ,34.2510442753976,-80.6387111123924
SC,45027,Elliot Millpond at Clarendon county ,33.6531992126878,-80.4921814223863
SC,45063,Fisher Pond at Lexington county ,33.9882170752249,-81.1398927126278
SC,45017,Gressette Pond at Calhoun county ,33.6849008542118,-80.9469087223907
SC,45017,Willie Rucker Pond at Calhoun county ,33.742525519639,-80.9081196968239
SC,45017,Ruckers Pond at Calhoun county ,33.7499009523891,-80.9034935653776
SC,45017,D H Wannamaker Pond at Calhoun county ,33.7271870877568,-80.9130955387394
SC,45045,Tall Pine Lakes at Greenville county ,35.0635448871905,-82.567127007154
SC,45017,Layseth Millpond at Calhoun county ,33.6688331146729,-81.0064091310806
SC,45051,Ripken Pond at Horry county ,33.7158632289266,-78.9046333858565
SC,45073,Mill Pond at Oconee county ,34.8914105277722,-83.1425526163199
SC,45073,Gordons Lake at Oconee county ,34.880913135052,-83.1309204848757
SC,45045,Methodist Pond at Greenville county ,35.0819259416879,-82.639890721242
SC,45045,Poplar Lake at Greenville county ,35.0922615559718,-82.4319753275065
SC,45075,Zeiglers Pond at Orangeburg county ,33.4580157515122,-80.9818756285366
SC,45039,Camp Longridge Lake at Fairfield county ,34.3517009420405,-80.8568427182286
SC,45073,Oconee State Park Lake Number One at Oconee county ,34.8662048332764,-83.1030151070602
SC,45079,Sunny Acres Pond at Richland county ,34.1418687725528,-80.9753632358486
SC,45011,L Lake at Barnwell county ,33.1827884715182,-81.6322690326934
SC,45079,Lake Elizabeth at Richland county ,34.1142432987816,-80.9855839443443
SC,45013,Lake Argo at Beaufort county ,32.2586899720518,-80.9711110382331
SC,45017,Brakefield Pond at Calhoun county ,33.6773697051591,-80.9608099307077
SC,45063,Hutto Pond at Lexington county ,33.8716106839758,-81.1209645394253
SC,45083,South Pacolet River Reservoir Number One at Spartanburg county ,35.1068389582549,-81.9940995946637
SC,45083,Lake Blalock at Spartanburg county ,35.0847424755891,-81.8905422429697
SC,45083,Lake Zimmerman at Spartanburg county ,34.8512167540149,-81.8956177290598
SC,45079,Murray Pond at Richland county ,33.9941113114212,-80.7132354111079
SC,45063,Pooles Millpond at Lexington county ,33.713774968597,-81.2472862388887
SC,45063,Shumpert Pond at Lexington county ,33.7190615132587,-81.2429190711763
SC,45021,Thicketty Creek Watershed 25 Reservoir at Cherokee county ,35.0101432813749,-81.7327165312227
SC,45047,Emerald Baptist Church Baptism Pool at Greenwood county ,34.2111431961387,-82.1630399362777
SC,45063,Crout Pond at Lexington county ,33.8951733215026,-81.3638701314367
SC,45085,Sawmill Pond at Sumter county ,33.9540003341092,-80.4211383338553
SC,45085,Loring Millpond at Sumter county ,33.9479462646118,-80.4241136998747
SC,45085,Mathis Pond at Sumter county ,33.8853735818308,-80.3901707500906
SC,45085,Lake Cherryvale at Sumter county ,33.960506787081,-80.4519911103202
SC,45085,Frierson Pond at Sumter county ,33.9589258749142,-80.4494417310974
SC,45017,Brady Pond at Calhoun county ,33.7702776787884,-80.8322160948336
SC,45085,Second Millpond at Sumter county ,33.9238808752495,-80.387371518879
SC,45085,Dubose Pond at Sumter county ,33.9624059799378,-80.3380606177795
SC,45055,Cool Springs Upper Pond at Kershaw county ,34.2874443288215,-80.6009168365547
SC,45085,Burns Pond at Sumter county ,33.885718755136,-80.4254304809612
SC,45085,Montagues Pond at Sumter county ,33.8742081818206,-80.4439928927324
SC,45085,Burnt Gin Lake at Sumter county ,33.8719869652947,-80.4995540335523
SC,45085,Gulledge Pond at Sumter county ,33.8666999653047,-80.5195707052559
SC,45085,Elliott Lake at Sumter county ,33.8503978311174,-80.4998517083971
SC,45085,Boyle Pond at Sumter county ,33.8804901573346,-80.4403781608742
SC,45085,McCray Lake at Sumter county ,33.8878766347749,-80.4631949323271
SC,45085,Whites Millpond at Sumter county ,33.9880100943622,-80.3278829422673
SC,45085,Dunn Lakes at Sumter county ,33.9644176914623,-80.5039487120188
SC,45085,Swan Lake at Sumter county ,33.9181082852263,-80.3697792328401
SC,45063,Grandview Pond at Lexington county ,34.0710513747278,-81.2198415577073
SC,45007,Frog Pond at Anderson county ,34.6214462451952,-82.4819289881651
SC,45051,Longwood Lakes Pond at Horry county ,33.7040145651517,-78.9593357130196
SC,45019,Hidden Pond at Charleston county ,32.5291892340212,-80.2810094198635
SC,45045,Whispering Meadow Retention Pond at Greenville county ,34.7658713300783,-82.3139253911506
SC,45043,Lake Lucas at Georgetown county ,33.3410079525229,-79.3449792586166
SC,45087,Lockhart Reservoir at Union county ,34.8067042984929,-81.4727682865387
SC,45027,Gator Lake at Clarendon county ,33.6964458660466,-80.1127569834892
SC,45015,Blackberry Pond at Berkeley county ,33.2656354067224,-79.857302625215
SC,45025,Gregory Jordan Pond at Chesterfield county ,34.720132879446,-80.33463688632
SC,45047,Retention Pond Pollinator Garden at Greenwood county ,34.1887508752158,-82.164646290645
SC,45035,Farm Pond at Dorchester county ,32.976359157775,-80.2293609831479
SC,45063,Ballingtons Pond at Lexington county ,33.8683133023428,-81.2580755637106
SC,45003,Boyd Pond at Aiken county ,33.4539828572959,-81.7940370855435
SC,45087,Cudds Pond at Union county ,34.7525388834316,-81.4931500333039
SC,45045,Stone Lake at Greenville county ,34.8767704490299,-82.3772041754611
SC,45023,Mountain Lakes at Chester county ,34.6613628592138,-81.2628248331972
SC,45023,Mountain Lakes - Upper Lake at Chester county ,34.6556826331472,-81.2532418038905
SC,45023,Chester Reservoir at Chester county ,34.7183523347803,-81.2506049892388
SC,45031,Bay Lake at Darlington county ,34.1397356718598,-80.0236449659147
SC,45079,Emerald Lake at Richland county ,33.9707068128628,-80.8977652261164
SC,45079,Otter Lake at Richland county ,33.9688357929114,-80.8955464133437
SC,45079,Lake Trotwood at Richland county ,33.9710936484019,-80.8918536307867
SC,45079,Lake Rebecca at Richland county ,33.9739458688772,-80.8874467829828
SC,45057,Arthur Jones Pond at Lancaster county ,34.5879818089872,-80.5984575237532
SC,45091,Bollinger Pond at York county ,35.1522315935399,-81.2494439123326
SC,45055,Hilton House Pond Dam D-1139 at Kershaw county ,34.4679495537059,-80.7681653498872
SC,45039,Cathcart Pond at Fairfield county ,34.3148115564922,-81.1167005385587
SC,45015,Smythe Park Pond at Berkeley county ,32.8451933619794,-79.9068621345578
SC,45041,Swimming Pond at Florence county ,33.868584263243,-79.8185807181142
SC,45063,Brodie Millpond at Lexington county ,33.8673445141315,-81.4652051113178
SC,45063,Abells Millpond at Lexington county ,33.8716456149589,-81.4563363926194
SC,45063,Taylor Pond at Lexington county ,33.9082572033612,-81.3964038845658
SC,45063,Koons Pond at Lexington county ,33.8997918598748,-81.3694830496975
SC,45073,Oconee State Park Lake Number Two at Oconee county ,34.8620124246163,-83.1092800789425
SC,45003,Horseshoe Pond at Aiken county ,33.5425170699646,-81.7307282887222
SC,45003,Swints Lake at Aiken county ,33.5940766956783,-81.9188206323632
SC,45003,Laurel Lake at Aiken county ,33.5751921712958,-81.9228082784636
SC,45003,Antique Lake at Aiken county ,33.6169962443694,-81.8815309362331
SC,45003,Morris Pond at Aiken county ,33.6312841817015,-81.7237188883888
SC,45003,Wrights Millpond at Aiken county ,33.5726202388283,-81.6315171605904
SC,45003,Scotts Lake at Aiken county ,33.5762017241171,-81.5976308570825
SC,45089,Ackerman Pond at Williamsburg county ,33.4779368679532,-79.6344718481666
SC,45089,Clemmons Pond at Williamsburg county ,33.4620080447636,-79.5783992710489
SC,45025,Pool J at Chesterfield county ,34.6020483990912,-80.256315600621
SC,45025,Oxpen Lake at Chesterfield county ,34.6063123360004,-80.2479903181876
SC,45025,Honkers Lake at Chesterfield county ,34.6045181872064,-80.2532350524813
SC,45025,Kidney Small Pond at Chesterfield county ,34.528558444922,-80.3308930826131
SC,45025,Kirkleys Pond at Chesterfield county ,34.5262512273505,-80.3306853642172
SC,45055,Hortons Pond at Kershaw county ,34.5075766847134,-80.3655599524221
SC,45025,Mays Lake at Chesterfield county ,34.57751703725,-80.179531482017
SC,45025,Meares Pond at Chesterfield county ,34.4779946191447,-80.2799033235658
SC,45033,Proposed septic and drainage field at Dillon county ,34.2812366028583,-79.1830201183212
SC,45033,Proposed well at Dillon county ,34.2818307371902,-79.1831382045459
SC,45037,Woodwards Lake at Edgefield county ,33.6454525966841,-81.8880855876922
SC,45073,Horseshoe Lake at Oconee county ,34.7733222277232,-83.2659508295393
SC,45003,Kimberly Clark Waste Water Basin at Aiken county ,33.4125231223184,-81.9056828564166
SC,45003,Ebbs Lake at Aiken county ,33.3843759706,-81.8847630004318
SC,45005,Myers Pond at Allendale county ,33.0927572967652,-81.5794253592807
SC,45037,Salters Pond at Edgefield county ,33.7635274147831,-81.8411217745827
SC,45037,Reynolds Pond at Edgefield county ,33.7589320895125,-81.8443335865527
SC,45003,Skinface Pond at Aiken county ,33.2388302483727,-81.7805886357257
SC,45003,Garner Pond Number One at Aiken county ,33.539386665781,-81.8938305713105
SC,45075,Peedee Lake at Orangeburg county ,33.2742228770954,-80.4422287034305
SC,45003,Outing Lake at Aiken county ,33.5964470766857,-81.7606004518484
SC,45015,Saxony Lake at Berkeley county ,33.129165373534,-80.1005248396809
SC,45049,Maulding Millpond at Hampton county ,32.9026377891386,-81.0387072936763
SC,45009,Hiers Pond at Bamberg county ,33.0541919550642,-81.0903427048118
SC,45037,Long Pond at Edgefield county ,33.7454484378059,-81.8029887475186
SC,45037,Samuels Pond at Edgefield county ,33.7576176018053,-81.8235414349802
SC,45037,Harrison Pond at Edgefield county ,33.7203041803995,-81.8151414497039
SC,45037,Mathis Pond at Edgefield county ,33.6957814388798,-81.8320981268384
SC,45037,Bigford Pond at Edgefield county ,33.6976743477029,-81.863692024808
SC,45037,Rainsford Pond at Edgefield county ,33.6941139850377,-81.9462686717708
SC,45091,Lake Crandall at York county ,35.0360769054539,-80.918830961829
SC,45091,Lake Frances at York county ,35.0377500707659,-80.9210131965828
SC,45091,Stumpy Pond at York county ,35.030811193081,-80.9198243764806
SC,45003,Sawyer Pond at Aiken county ,33.7762249382631,-81.5611112508158
SC,45003,Edisto Lake at Aiken county ,33.6760700020345,-81.3232356408113
SC,45003,Rawls Pond at Aiken county ,33.6934451255177,-81.3042725672431
SC,45003,Amelia Lake at Aiken county ,33.6860174002138,-81.3120639331053
SC,45003,Collums Millpond at Aiken county ,33.6796971100082,-81.3401112125778
SC,45003,Bonnie Lake at Aiken county ,33.7216081504387,-81.4207838853534
SC,45045,Hugey Pond at Greenville county ,35.0667915902473,-82.2725790735418
SC,45045,Vaughn Pond at Greenville county ,35.0069775197747,-82.2227388961891
SC,45091,Lake Azure at York county ,35.0512170700465,-80.9156356764343
SC,45061,McGuirts Millpond at Lee county ,34.1358337103792,-80.3401853278049
SC,45059,Duncan Creek Watershed Number 6b Reservoir at Laurens county ,34.5455342927321,-81.9131679483132
SC,45003,Briggs Pond at Aiken county ,33.4991518953729,-81.9769751612462
SC,45015,Goose Creek Reservoir at Berkeley county ,32.949925863137,-80.0266002231306
SC,45041,Fishing Pond at Florence county ,33.8688686584467,-79.8219564117259
SC,45041,Main Garden Pond at Florence county ,33.8695489079202,-79.8227361884082
SC,45089,Two Ponds at Williamsburg county ,33.8745176403991,-79.8317661640568
SC,45069,Dailys Pond at Marlboro county ,34.4781976195371,-79.6577969654035
SC,45069,Poston Pond at Marlboro county ,34.4852428790868,-79.6517112338141
SC,45051,Mishoe Pond at Horry county ,33.9833567459438,-78.996515444422
SC,45069,Camp Sandy Ridge Pond at Marlboro county ,34.7390457296906,-79.761175233308
SC,45041,J H Holliday Pond at Florence county ,33.8884737567275,-79.525866039467
SC,45041,Richard Holliday Pond at Florence county ,33.8788878186286,-79.6030993541678
SC,45041,Matthews Pond at Florence county ,33.943271240881,-79.6689754727395
SC,45089,Jack McGill Pond at Williamsburg county ,33.6842893014531,-79.6639957258015
SC,45089,Longlands House Pond at Williamsburg county ,33.5055961246985,-79.9509455941535
SC,45027,Berry Pond at Clarendon county ,33.7031240491512,-80.2866019255676
SC,45027,Edna Ward Pond at Clarendon county ,33.7136529198104,-80.2684724163013
SC,45027,Lakewood Pond at Clarendon county ,33.7323904110357,-80.0960613764254
SC,45085,McLaurins Pond at Sumter county ,33.911247634587,-80.5143282853899
SC,45085,Deschamps Big Pond at Sumter county ,33.8410276351922,-80.367120393228
SC,45061,Newell Pond at Lee county ,34.142130566025,-80.3790613684444
SC,45061,Corbitts Millpond at Lee county ,34.1855621044032,-80.3842150656593
SC,45061,Mary Lees Pond at Lee county ,34.2119026618946,-80.2840677692102
SC,45031,Andrews Millpond at Darlington county ,34.2222282586452,-80.0677605242965
SC,45031,Boyds Pond at Darlington county ,34.162002221725,-80.0139370909656
SC,45027,Buddin Pond at Clarendon county ,33.8341764225533,-79.9544194485186
SC,45027,Rainbow Lake at Clarendon county ,33.8129930685,-80.0918834051229
SC,45027,Alderman Pond at Clarendon county ,33.8003490604002,-80.1662225283654
SC,45027,Mcfaddens Pond at Clarendon county ,33.8457026003177,-80.1196111412662
SC,45027,Summerton Waste Treatment Pond at Clarendon county ,33.5761460114352,-80.3500138774304
SC,45085,Weeks Pond at Sumter county ,33.776615754473,-80.4540090387908
SC,45085,Cain Pond at Sumter county ,33.8387387976578,-80.4591853326994
SC,45063,Ansel Smith Pond at Lexington county ,33.8809747737412,-81.4763887040323
SC,45063,Kneece Pond at Lexington county ,33.8141141051045,-81.4608725010783
SC,45003,Morris Lake at Aiken county ,33.7045443011171,-81.6787918965262
SC,45003,Wilson Pond at Aiken county ,33.5092292860613,-81.7492940134308
SC,45003,Suhrer Lake at Aiken county ,33.5033241118687,-81.7564360073233
SC,45003,Herndon Pond at Aiken county ,33.4713013489153,-81.7881899616534
SC,45003,Mixon Lake at Aiken county ,33.387086657021,-81.8118786337217
SC,45003,Sudlow Lake at Aiken county ,33.5486975991935,-81.8833054899712
SC,45003,Bakers Lake at Aiken county ,33.5742707564805,-81.884123590246
SC,45003,Howards Pond at Aiken county ,33.5635419145347,-81.9057844598647
SC,45003,Vaucluse Pond at Aiken county ,33.6189770217101,-81.8080735604727
SC,45003,Seivern Lake at Aiken county ,33.7331107766419,-81.4887644626657
SC,45003,Brogmans Pond at Aiken county ,33.7361953281342,-81.4776551667168
SC,45063,Kings Pond at Lexington county ,33.7041322021948,-81.1858043528323
SC,45017,A S Smoak Pond at Calhoun county ,33.6375367062309,-80.9690130256619
SC,45027,Cypress Lake at Clarendon county ,33.8527429803811,-80.0055251299143
SC,45027,Home Lake at Clarendon county ,33.7227408589044,-80.043448344956
SC,45027,Martins Lake at Clarendon county ,33.6923886495693,-80.0210689687826
SC,45001,C F Saver Company Farm Lake at Abbeville county ,34.3993395745213,-82.4035842387382
SC,45013,Hammermill Lane Pond at Beaufort county ,32.2586512746423,-80.9893619167655
SC,45083,Chestnut Lake at Spartanburg county ,35.0060335947533,-82.0508883396708
SC,45077,Dons Pond at Pickens county ,34.9176369160091,-82.73250984734
SC,45019,Stormwater Pond at Charleston county ,32.9633374064476,-80.0477475833324
SC,45011,Pond Five at Barnwell county ,33.2620348963334,-81.5623726443481
SC,45011,Pond B at Barnwell county ,33.2969775732239,-81.5485346349665
SC,45085,Dinkins Millpond at Sumter county ,34.0368782792608,-80.5309973313102
SC,45025,Lake Robinson at Chesterfield county ,34.4400997427658,-80.1552919994034
SC,45077,Keasler Pond at Pickens county ,34.9163137596252,-82.8426669149461
SC,45077,Lake Carlton at Pickens county ,34.9258570514879,-82.8219591398763
SC,45091,Burkette Lake at York county ,34.8657828178954,-80.9572844681549
SC,45003,Baileys Pond at Aiken county ,33.5959722555992,-81.2869821548401
SC,45055,Wiedemann Pond at Kershaw county ,34.2353902750196,-80.8258001272977
SC,45057,Tailings Pond at Lancaster county ,34.6140855561543,-80.5430110122875
SC,45003,Williams Lake at Aiken county ,33.5855870651093,-81.8671572333289
SC,45003,Ascauga Lake at Aiken county ,33.5704412678691,-81.87520857425
SC,45037,Gregorys Lake at Edgefield county ,33.5626632093076,-81.9831157284054
SC,45003,Wildwood Lake at Aiken county ,33.6212614277883,-81.6719078449872
SC,45003,Johnson Lake at Aiken county ,33.6150682382567,-81.6706130071441
SC,45031,Gilbert Lake at Darlington county ,34.3965962395816,-79.9499405757316
SC,45025,Lake Susan at Chesterfield county ,34.5560651319323,-79.8805218703787
SC,45013,Lake Somerset at Beaufort county ,32.2886457428805,-80.9440613578901
SC,45051,Martin Duck Pond at Horry county ,33.7910940901892,-79.1642984421074
SC,45037,Odell Memorial Lake at Edgefield county ,33.7793217114413,-81.8955000551029
SC,45037,Carpenters Pond at Edgefield county ,33.6882142463729,-81.8305423522951
SC,45003,Smiths Lake at Aiken county ,33.6803649743205,-81.7918437360351
SC,45003,Camp Long Lake at Aiken county ,33.6797001679129,-81.6227706901949
SC,45003,Huttos Pond at Aiken county ,33.7238714139697,-81.5424668071259
SC,45003,Anderson Lake at Aiken county ,33.716968055364,-81.5305118012554
SC,45063,McIver Pond at Lexington county ,33.7622814394192,-81.3451744253646
SC,45003,Barrs Ponds at Aiken county ,33.7100991638323,-81.3411080981616
SC,45003,Poole Pond at Aiken county ,33.6315098576676,-81.2670387746991
SC,45003,Caughman Lake at Aiken county ,33.635265560156,-81.2214395753617
SC,45003,Corbett Lake at Aiken county ,33.6460158619382,-81.211858736134
SC,45075,Moods Pond at Orangeburg county ,33.5989837440441,-81.2064294165636
SC,45075,Jones Pond at Orangeburg county ,33.5873255888999,-81.1758420461646
SC,45075,Harleys Mill Pond at Orangeburg county ,33.5846317875158,-81.151762859603
SC,45075,Hutto Mill Pond at Orangeburg county ,33.5546274262754,-81.0558408193634
SC,45075,Conner Pond at Orangeburg county ,33.5309634034062,-81.0575286150394
SC,45075,Davis Ponds at Orangeburg county ,33.5101196375736,-81.0547420937781
SC,45075,John Fogle Pond at Orangeburg county ,33.4914400107584,-81.0741763254276
SC,45075,Twin Lakes at Orangeburg county ,33.49054158177,-81.0756124177775
SC,45075,Dean Swamp Pond at Orangeburg county ,33.5159499061943,-81.3192715958767
SC,45003,Goodyear Pond at Aiken county ,33.5373459241287,-81.4103464471139
SC,45003,Tylers Pond at Aiken county ,33.5543556772839,-81.4084732607311
SC,45003,Millers Pond at Aiken county ,33.5884606243175,-81.3448445408534
SC,45003,Capers Mill Pond at Aiken county ,33.5794316252577,-81.2903968622949
SC,45003,Brodies Pond at Aiken county ,33.6119798021522,-81.3811228646486
SC,45003,Williams Pond at Aiken county ,33.6249544588261,-81.4020743104482
SC,45003,Garvins Millpond at Aiken county ,33.6366097022,-81.414442185131
SC,45003,Cofer Pond at Aiken county ,33.6422696759292,-81.4253999519582
SC,45003,Johnsons Mill Pond at Aiken county ,33.6013038080317,-81.6352161517828
SC,45003,Edisto Plant Settling Basin Hube at Aiken county ,33.6543582975997,-81.5692978785448
SC,45003,Laughlin Pond at Aiken county ,33.6396373975824,-81.5773223441771
SC,45003,Snipes Pond at Aiken county ,33.6403220281464,-81.5953288681173
SC,45003,Kirklands Pond at Aiken county ,33.7020796257941,-81.5223404690295
SC,45003,Carter Pond at Aiken county ,33.7105957572819,-81.5383626701821
SC,45003,Garvin Lower Pond at Aiken county ,33.645351482354,-81.4867850389271
SC,45003,Kennedy Pond at Aiken county ,33.6368347569146,-81.4770678664734
SC,45003,Swartz Pond at Aiken county ,33.6303926116202,-81.4828172841149
SC,45003,Garvins Pond at Aiken county ,33.622399572064,-81.4859335998877
SC,45003,Baughmans Mill Pond at Aiken county ,33.5896488295659,-81.4644375319276
SC,45003,Dibbles Pond at Aiken county ,33.5002710631346,-81.6490863575112
SC,45037,Pearsons Pond at Edgefield county ,33.6668837291228,-81.8483870534249
SC,45077,Twelvemile River Watershed 12 Reservoir at Pickens county ,34.8707614493534,-82.62898319581
SC,45055,George West Pond at Kershaw county ,34.4022444236901,-80.5126829545531
