st2,GEOID,lake,lat,lon
NJ,34027,Walrus Pond at Morris county ,40.8320340301207,-74.4672693893277
NJ,34037,Morris Lake at Sussex county ,41.0468070697925,-74.6067114195345
NJ,34037,Glen Lake at Sussex county ,41.0407365864683,-74.6072750134923
NJ,34039,Milton Lake at Union county ,40.6071621615013,-74.3011311292404
NJ,34025,Jumping Brook Reservoir at Monmouth county ,40.2036272883228,-74.0662816925733
NJ,34031,Mount Laurel Lake at Passaic county ,41.1628588055244,-74.3907806920217
NJ,34005,Presidential Lakes at Burlington county ,39.9082779424565,-74.5736300695987
NJ,34005,Lebanon Lake at Burlington county ,39.9035102460225,-74.5623076461674
NJ,34003,Teal Pool at Bergen county ,40.7864251896639,-74.1091851970077
NJ,34003,Kingsland Impoundment at Bergen county ,40.7837837159633,-74.1006630715558
NJ,34031,Upper Greenwood Lake at Passaic county ,41.1751383553146,-74.3805658830246
NJ,34027,Dogwood Pond at Morris county ,41.0301983838824,-74.4892125003504
NJ,34029,Pohatcong Lake at Ocean county ,39.6045399287449,-74.3453735889113
NJ,34013,Taylor Lake at Essex county ,40.7536679290575,-74.3346166873978
NJ,34027,Noe Pond at Morris county ,40.7363092356443,-74.4241797683883
NJ,34025,Secretariat Pond at Monmouth county ,40.2633807871889,-74.3556531715375
NJ,34025,Mib Pond at Monmouth county ,40.2672846742265,-74.3494454353517
NJ,34025,Krazy Pond at Monmouth county ,40.2677245377225,-74.352078209029
NJ,34025,Wintergreen Pond at Monmouth county ,40.2661750603204,-74.3537007818983
NJ,34009,Wawa Vernal Pool at Cape May county ,38.9834311116667,-74.9412131016381
NJ,34025,Marlu Lake at Monmouth county ,40.3367399346958,-74.1565411795053
NJ,34041,Vermal Pool at Warren county ,40.7620252866201,-74.9201124469941
NJ,34003,Glen Rock Duck Pond at Bergen county ,40.9611369577783,-74.1082244996755
NJ,34027,Memorial Park Pond at Morris county ,40.9256159304651,-74.6359157002831
NJ,34033,Alloway Lake at Salem county ,39.568110654274,-75.3525343106468
NJ,34027,Lake Rickabear at Morris county ,40.9662324536213,-74.4105708148993
NJ,34027,Cozy Lake at Morris county ,41.0158821954706,-74.5017338198579
NJ,34037,Hughs Pond at Sussex county ,40.9975713578437,-74.6883386831707
NJ,34029,Eno's Pond at Ocean county ,39.8379463930948,-74.1617228791582
NJ,34025,Zen Lake at Monmouth county ,40.3640860957486,-74.1686640740605
NJ,34009,Sunset Lake at Cape May county ,38.9757197217321,-74.843592277451
NJ,34031,Pompton Lake at Passaic county ,41.0049997372127,-74.2752384059287
NJ,34027,Horseshoe Lake at Morris county ,40.8585219429179,-74.6344169336987
NJ,34009,No Wake Zone at Cape May county ,39.0077170559162,-74.8296736029145
NJ,34027,Sokol Pond at Morris county ,40.9358298394378,-74.4560370251298
NJ,34019,Round Valley Reservoir at Hunterdon county ,40.6161223782484,-74.8259308804345
NJ,34037,Musscenetcong Iron Works Basin at Sussex county ,40.9008643293971,-74.7101186144467
NJ,34037,Gardners Pond at Sussex county ,41.004672969112,-74.7387312008367
NJ,34015,Sunset Lake at Gloucester county ,39.6352373373866,-74.9693132575773
NJ,34001,Cains Mill Lake at Atlantic county ,39.6020477316801,-74.8844336418626
NJ,34025,Lower Pond at Monmouth county ,40.3337963938156,-74.2336170793626
NJ,34025,Upper Pond at Monmouth county ,40.3338951914208,-74.2327586648569
NJ,34029,Dillon's Creek Marina at Ocean county ,39.9452773549601,-74.1370897581236
NJ,34001,Lake Lenape at Atlantic county ,39.4678843788342,-74.7409177193783
NJ,34001,Lake Fred at Atlantic county ,39.4955611552064,-74.5321801398961
NJ,34041,Duck Pond at Warren county ,41.0055475616013,-74.922676871147
NJ,34025,Stockton Lake at Monmouth county ,40.1209474237488,-74.0388064095269
NJ,34027,Barton Pond at Morris county ,40.8818307825573,-74.4675170383997
NJ,34027,Rainbow Lake at Morris county ,40.8817586546615,-74.463087527095
NJ,34027,Mirror Lake at Morris county ,40.8817349524215,-74.4596016200597
NJ,34027,Fern Lake at Morris county ,40.8786218427342,-74.4613447695456
NJ,34027,Upper Rainbow Lake at Morris county ,40.8796225671064,-74.4600082061654
NJ,34027,Cabin Lake at Morris county ,40.8784614156295,-74.4572395984953
NJ,34027,Twilight Lake at Morris county ,40.880341157674,-74.4563897915102
NJ,34001,Lake Nescochague at Atlantic county ,39.6361540530898,-74.6636289783215
NJ,34009,Clint Millpond at Cape May county ,39.15442775291,-74.8153279685149
NJ,34035,Horizon Way Basin at Somerset county ,40.6050047458267,-74.4961567537655
NJ,34037,Beaver Lake at Sussex county ,41.0888904661344,-74.5616532987663
NJ,34011,East Lake at Cumberland county ,39.4303191471204,-75.2224864357596
NJ,34041,Allamuchy Pond at Warren county ,40.9116387357815,-74.8155911761629
NJ,34037,Fox Hollow Lake at Sussex county ,41.0407382459882,-74.6644797477185
NJ,34037,Upper Mohawk Lake at Sussex county ,41.0327528248862,-74.6596983023023
NJ,34037,Lake Mohawk at Sussex county ,41.0195259391551,-74.6591314950719
NJ,34017,Little Basin at Hudson county ,40.712062490936,-74.0364096990149
NJ,34017,Morris Canal Basin at Hudson county ,40.7108741044027,-74.0416566102263
NJ,34025,Brindle Lake at Monmouth county ,40.2084724076422,-74.1995240933128
NJ,34025,Hidden Pond at Monmouth county ,40.2650439155761,-74.3467517581449
NJ,34025,Little Hidden Pond at Monmouth county ,40.262443514718,-74.3436917402299
NJ,34037,West Highland Lake at Sussex county ,41.1765732149885,-74.4753107469047
NJ,34029,Swains Bog at Ocean county ,39.8857843021635,-74.3442829185821
NJ,34029,Swordens Pond at Ocean county ,39.8832207830753,-74.2257473729671
NJ,34037,Highland Lake at Sussex county ,41.1683062702076,-74.4641486912166
NJ,34041,Upper Yards Creek Reservior at Warren county ,41.0037699617742,-75.0498812569451
NJ,34009,Daveys Lake at Cape May county ,38.9516433372004,-74.9653237525596
NJ,34013,Kingsland Lake at Essex county ,40.8258916380559,-74.1424781956966
NJ,34025,Parker Homestead pond at Monmouth county ,40.3430874116065,-74.0400887945417
NJ,34011,Union Lake at Cumberland county ,39.4169734832747,-75.0624743811507
NJ,34031,Monksville Reservoir at Passaic county ,41.1281230371753,-74.3079075483061
NJ,34041,Lower Yards Creek Reservior at Warren county ,41.0058633864852,-75.0206051764068
NJ,34033,Willow Grove Lake at Salem county ,39.5549357623159,-75.0729264129058
NJ,34041,Gramercy Pond at Warren county ,41.0173699872456,-74.9276817246609
NJ,34037,Lake Hopatcong at Sussex county ,40.9485721356465,-74.6374906968914
NJ,34027,Creek at Morris county ,40.8559630916086,-74.5335284580053
NJ,34019,Lingerts Pond at Hunterdon county ,40.6337173450721,-74.9261098732289
NJ,34041,Bass Lake at Warren county ,41.0261259680616,-74.9525955901397
NJ,34003,Demarest Duck Pond at Bergen county ,40.9561842927259,-73.9624721594841
NJ,34027,Liebenzell USA Pond at Morris county ,40.8010105190715,-74.8162348843373
NJ,34027,Liebenzell Retreat Pond at Morris county ,40.7941647814361,-74.8263909930541
NJ,34005,Atsion Lake at Burlington county ,39.7415974832026,-74.7370662069313
NJ,34033,Lake Inferior at Salem county ,39.5780657019675,-75.2014129275217
NJ,34025,Lake Lefferts at Monmouth county ,40.4108331745633,-74.2413107688401
NJ,34025,Sunset Lake at Monmouth county ,40.225479890543,-74.0050994639369
NJ,34007,Cooper River Lake at Camden county ,39.9256496541506,-75.0695731191629
NJ,34027,Lakeview Terriost Lake with waterfall at Morris county ,40.9144965044598,-74.3527107095046
NJ,34027,Hoot Owl Lake at Morris county ,41.0007603002592,-74.4040830490542
NJ,34041,Kopycinski Pond at Warren county ,41.0144244382631,-74.9646903044949
NJ,34007,Newton Lake at Camden county ,39.9066108587247,-75.0803204866802
NJ,34027,Stillwell Pond at Morris county ,40.9571513968098,-74.5240991425192
NJ,34025,Dery's Pond at Monmouth county ,40.3560661101451,-74.0312672275329
NJ,34005,Penn Swamp Pond at Burlington county ,39.691071780176,-74.6361360647011
NJ,34005,Manni's Duck Pond at Burlington county ,39.7440849536349,-74.66664637729
NJ,34029,Governors Pond at Ocean county ,39.703007377631,-74.3869492098183
NJ,34003,Duck Pond at Bergen county ,40.9785810627541,-73.9804937233068
NJ,34031,Ramapo Lake at Passaic county ,41.0368977682688,-74.2654300908129
NJ,34031,Sally's Pond at Passaic county ,41.1371095470332,-74.2579063895384
NJ,34031,Glasmere Ponds at Passaic county ,41.1194818654148,-74.2270893949762
NJ,34031,Stephens Lake at Passaic county ,41.0553723165198,-74.2678202462851
NJ,34031,Pinecliff Reservoir at Passaic county ,41.1377971070829,-74.3863163031832
NJ,34037,Wawayanda Lake at Sussex county ,41.181513616652,-74.4333175302003
NJ,34031,Lake Sonoma at Passaic county ,41.0993367039022,-74.3375803100472
NJ,34031,Butler Reservoir at Passaic county ,41.0294583741932,-74.3859231194122
NJ,34037,Swartswood Lake at Sussex county ,41.0726151195181,-74.8358941035441
NJ,34037,Brink Pond at Sussex county ,41.2400832270053,-74.6789017840662
NJ,34037,Ice Pond at Sussex county ,41.2379990670518,-74.6822229203997
NJ,34003,Potash Lake at Bergen county ,41.0210037786375,-74.259625555532
NJ,34029,The Bowl at Ocean county ,39.8140216099382,-74.1903186019805
NJ,34041,Dunnfield Creek Falls Swimming Hole at Warren county ,40.9775598654588,-75.1205213698616
NJ,34037,Franklin Pond at Sussex county ,41.107956622562,-74.5858112799083
NJ,34029,Mallard Lake at Ocean county ,40.0263442814011,-74.1624146300977
NJ,34023,Davidsons Millpond at Middlesex county ,40.407463174784,-74.5053750920521
NJ,34025,Bucks Pond at Monmouth county ,40.287617262887,-74.2013393928528
