st2,GEOID,lake,lat,lon
OR,41005,Dumbbell Lake at Clackamas county ,45.3570161859692,-121.846343420258
OR,41019,Paris Reservoir at Douglas county ,43.3050359660489,-122.877057275654
OR,41065,Green Lake at Wasco county ,45.2180399821545,-121.652532227839
OR,41067,Timber Junction Pond at Washington county ,45.7604976089681,-123.300570100429
OR,41067,Wilcox Pond at Washington county ,45.5165342560037,-122.955352325776
OR,41057,Moroney Canal at Tillamook county ,45.629830981859,-123.938639062147
OR,41005,High Lake at Clackamas county ,45.078752451591,-122.121535190405
OR,41005,Lily Pad Lake at Clackamas county ,44.9353132914079,-122.114826963679
OR,41039,Craig Lake at Lane county ,44.2491004774931,-121.836600323606
OR,41031,Link Lake at Jefferson county ,44.3999434190612,-121.801401695981
OR,41031,Cache Lake at Jefferson county ,44.3937372855945,-121.780861244034
OR,41017,Shadow Lake at Deschutes county ,44.3611249669737,-121.817122948065
OR,41031,Hand Lake at Jefferson county ,44.3935875584764,-121.794301468138
OR,41017,Hortense Lake at Deschutes county ,44.3760322214925,-121.81197825175
OR,41031,Dollar Nine Lake at Jefferson county ,44.3944570591098,-121.805609869402
OR,41017,Peewee Lake at Deschutes county ,44.3816987454203,-121.809597666425
OR,41031,Sand Camp Lake at Jefferson county ,44.3935797212888,-121.816177308779
OR,41017,Bone Lake at Deschutes county ,44.3923013450794,-121.802536323063
OR,41017,Torso Lake at Deschutes county ,44.3855934473909,-121.804652216037
OR,41017,Meadow Lake at Deschutes county ,44.3902572174538,-121.811067076763
OR,41017,Four O'Clock Lake at Deschutes county ,44.3781753170669,-121.806196573741
OR,41043,Rainbow Lake at Linn county ,44.6740599254736,-122.082373810609
OR,41043,Mud Puppy Lake at Linn county ,44.6852134104272,-122.067272844554
OR,41039,Elf Lake at Lane county ,44.2185094881751,-121.913805356636
OR,41047,Gibson Lake at Marion county ,44.7737780672259,-121.780177156624
OR,41047,Short Lake at Marion county ,44.7992502404694,-121.995846782476
OR,41047,Papoose Lakes at Marion county ,44.7541873697014,-121.776414792863
OR,41047,Leone Lake at Marion county ,44.7547010553066,-122.003028879085
OR,41047,Double Peaks Lake at Marion county ,44.8062409358915,-121.833152146103
OR,41047,Giebeler Lake at Marion county ,44.8080187825286,-122.148612019309
OR,41047,Babe Lake at Marion county ,44.7528189067917,-121.81100225159
OR,41043,Peasley Lake at Linn county ,44.6714142528067,-121.958646513962
OR,41043,Presley Lake at Linn county ,44.5821706857206,-121.942026719669
OR,41043,Bear Lake at Linn county ,44.6578143447918,-122.043614659144
OR,41043,Nan-Scott Lake at Linn county ,44.6212864808718,-121.957070541103
OR,41043,Tule Lake at Linn county ,44.5612185023682,-122.046575953809
OR,41043,Jo Jo Lake at Linn county ,44.6859662919941,-122.000412719063
OR,41017,Stormy Lake at Deschutes county ,43.8538311979699,-121.966414126526
OR,41017,Goldeneye Lake at Deschutes county ,43.9174049519541,-121.849642201968
OR,41017,Brahma Lake at Deschutes county ,43.8383200054568,-121.948834315893
OR,41017,Found Lake at Deschutes county ,43.7223598527549,-121.957573358582
OR,41017,Barbie Lakes at Deschutes county ,43.8202643209115,-121.950728153114
OR,41017,Swede Lake at Deschutes county ,43.8178952397509,-121.939031617784
OR,41043,Bingham Lake at Linn county ,44.6161358250665,-121.854638179963
OR,41017,Leech Lake at Deschutes county ,43.9210067115048,-121.860733921209
OR,41039,Drury Lake at Lane county ,44.0527373546862,-121.891870284339
OR,41039,Hidden Lake at Lane county ,44.0196553894247,-122.237487666034
OR,41031,Box Canyon Reservoir at Jefferson county ,44.6226784940227,-121.426534589775
OR,41039,Karl Lake at Lane county ,44.0727736994208,-122.120773562458
OR,41017,Taylor Lake at Deschutes county ,43.8064175105321,-121.958485219507
OR,41017,Pocket Lake at Deschutes county ,43.8350370102099,-121.947571525522
OR,41017,Riffle Lake at Deschutes county ,43.8183159432319,-121.957290510007
OR,41017,George Lake at Deschutes county ,44.319249887867,-121.826909173774
OR,41043,Lizard Lake at Linn county ,44.6271727365309,-121.868842462772
OR,41031,Juniper Reservoir at Jefferson county ,44.5402984015346,-121.377638305891
OR,41017,Harlequin Lake at Deschutes county ,43.8086967666059,-121.928069343921
OR,41039,Irish Camp Lake at Lane county ,44.2003424069314,-121.924268168807
OR,41017,Hidden Lake at Deschutes county ,43.724341265639,-121.966402759848
OR,41017,Johnny Lake at Deschutes county ,43.7260797157912,-121.916061977339
OR,41039,Nash Lake at Lane county ,44.0536654740385,-121.875154913986
OR,41017,Josephine Lake at Deschutes county ,43.8418052826339,-121.964844729569
OR,41017,Lemish Lake at Deschutes county ,43.7872418508376,-121.910038158365
OR,41047,Meridian Lake at Marion county ,44.7365626551863,-123.027500145856
OR,41017,Rock Rim Lake at Deschutes county ,43.8465216615393,-121.96625915756
OR,41039,Spy Lake at Lane county ,43.9575432599991,-121.908395242382
OR,41017,Dugout Lake at Deschutes county ,44.3143097319269,-121.763915717481
OR,41039,Denude Lake at Lane county ,44.0398031026695,-121.835568986043
OR,41017,Lady Lake at Deschutes county ,43.8299333216679,-121.946214035701
OR,41017,Lily Lake at Deschutes county ,43.7729660770694,-121.961278062658
OR,41043,Papoose Lake at Linn county ,44.6158383137801,-121.837499792905
OR,41039,Separation Lake at Lane county ,44.0821335154707,-121.961236802425
OR,41017,East Hanks Lake at Deschutes county ,43.8068216070925,-121.932096134629
OR,41017,Raft Lake at Deschutes county ,43.8057582953254,-121.906929203191
OR,41017,Sisters Mirror Lake at Deschutes county ,44.040511561211,-121.828016576907
OR,41039,McFarland Lake at Lane county ,43.8717875818643,-121.979272924016
OR,41043,Kreilich Reservoir at Linn county ,44.7576500301732,-122.756822639788
OR,41031,Dry Lake at Jefferson county ,44.4637457143283,-121.416478144117
OR,41039,Bounty Lake at Lane county ,44.0419356004861,-121.833499262926
OR,41017,Irish Lake at Deschutes county ,43.8113366478153,-121.960988644982
OR,41017,Phantom Lake at Deschutes county ,43.8157705400542,-121.93485798489
OR,41039,McBee Lake at Lane county ,43.9682205867072,-121.920718196644
OR,41017,Lindick Lake at Deschutes county ,43.8669717306611,-121.95865030361
OR,41039,Lancelot Lake at Lane county ,44.043694059981,-121.833356093117
OR,41047,Siegmund Reservoir at Marion county ,44.8093215337482,-122.692501245642
OR,41039,Lindh Lake at Lane county ,43.9538523712411,-121.931637434485
OR,41047,Kinsey Reservoir at Marion county ,44.7901883527506,-122.702898744259
OR,41039,Dillion Lake at Lane county ,44.0284977484581,-121.970780265367
OR,41017,Lois Lake at Deschutes county ,43.8048824821975,-121.915329750079
OR,41017,Red Slide Lake at Deschutes county ,43.8313377752014,-121.947908204885
OR,41017,Gleneden Lake at Deschutes county ,43.8259144667738,-121.946944508775
OR,41017,Pygmy Lake at Deschutes county ,43.8210863301746,-121.949281485776
OR,41017,Navaho Lake at Deschutes county ,43.8288407362609,-121.923085020782
OR,41039,Marten Lake at Lane county ,43.99249505387,-121.890733953011
OR,41039,Mile Lake at Lane county ,43.9955910829297,-121.882318701257
OR,41047,Wil-Lyn Reservoir at Marion county ,44.7260953798851,-122.954655992325
OR,41043,Crescent Lake at Linn county ,44.4531606678827,-122.089819743617
OR,41017,Blaze Lake at Deschutes county ,43.856592583846,-121.961741847462
OR,41039,Bedortha Reservoir at Lane county ,44.2334990796614,-122.822218975802
OR,41039,East McFarland Lake at Lane county ,43.8741043972263,-121.964143622936
OR,41031,Fly Lake at Jefferson county ,44.5398011747043,-121.431241029193
OR,41017,Sundew Lake at Deschutes county ,43.8108234707562,-121.944466110698
OR,41017,Timmy Lake at Deschutes county ,43.8280943001593,-121.948055838891
OR,41017,Cathy Lake at Deschutes county ,43.8346769671193,-121.937619414946
OR,41039,Spring Lake at Lane county ,44.1892929448785,-121.866015882159
OR,41017,Tranquil Lake at Deschutes county ,43.8215006097233,-121.944272606452
OR,41017,Blowdown Lake at Deschutes county ,43.8012290233435,-121.944115260916
OR,41039,Reese Lake at Lane county ,44.1147336396341,-121.810111636265
OR,41031,Junction Lake at Jefferson county ,44.5963742069466,-121.785240198049
OR,41017,Lodgepole Lake at Deschutes county ,43.816940616404,-121.927057488555
OR,41017,Junco Lake at Deschutes county ,44.0219155437444,-121.817429082616
OR,41017,Jay Lake at Deschutes county ,43.8109747112978,-121.909969749103
OR,41017,Kinnikinnic Lake at Deschutes county ,43.8174946828551,-121.933721639708
OR,41017,Heather Lake at Deschutes county ,43.8121625184317,-121.956616757092
OR,41017,Simon Lake at Deschutes county ,43.8221462198911,-121.938640963467
OR,41039,Piper Lake at Lane county ,43.8740327604364,-121.984297140076
OR,41017,Copper Lake at Deschutes county ,43.8279493221878,-121.938766685258
OR,41017,West Hanks Lake at Deschutes county ,43.8083212979079,-121.93849046816
OR,41017,Camelot Lake at Deschutes county ,44.0397904328116,-121.83275852718
OR,41017,Middle Hanks Lake at Deschutes county ,43.8083640646397,-121.934942154888
OR,41017,Merle Lake at Deschutes county ,43.82073962958,-121.925301741284
OR,41017,Jezebel Lake at Deschutes county ,43.8450976287895,-121.957312337913
OR,41043,Heart Lake at Linn county ,44.3830389133807,-122.086104553319
OR,41039,Park Lake at Lane county ,43.9962647447989,-121.889652703151
OR,41017,Little Finger Lake at Deschutes county ,43.8913812160046,-121.889873409474
OR,41047,Alder Creek Reservoir at Marion county ,44.800726898114,-122.676645836112
OR,41017,Grouse Lake at Deschutes county ,43.6947559387576,-121.948853895869
OR,41017,Comma Lake at Deschutes county ,43.8511007404564,-121.856335486077
OR,41017,Strider Lake at Deschutes county ,43.8045153727511,-121.91162449526
OR,41017,Kershaw Lake at Deschutes county ,43.8148132326903,-121.938821971223
OR,41039,Krag Lake at Lane county ,43.9610481135887,-121.889566686598
OR,41017,Dennis Lake at Deschutes county ,43.8634467724412,-121.963520730082
OR,41017,Clark Lake at Deschutes county ,43.820203189826,-121.949724351458
OR,41039,Honey Lakes at Lane county ,44.1030248675973,-121.874484840127
OR,41047,Heater Reservoir at Marion county ,44.8069754604286,-122.6815761737
OR,41045,Grassy Reservoir at Malheur county ,43.6738630625857,-117.391521563396
OR,41045,Schweizer Reservoir at Malheur county ,43.6701466208484,-117.353666838937
OR,41045,Blackjack Butte Reservoir at Malheur county ,43.6730266125595,-117.153023843615
OR,41045,Alkali Draw Reservoir at Malheur county ,43.6044397088345,-117.168008931309
OR,41045,Homestead Reservoir at Malheur county ,43.4920885203082,-117.433669454218
OR,41045,Coyote Reservoir at Malheur county ,43.4874616573603,-117.188330146701
OR,41045,Dry Lake at Malheur county ,43.5801570175482,-117.268802423718
OR,41045,Oxbow Reservoir at Malheur county ,43.6439597520322,-117.333432167606
OR,41045,North Grassy Mountain Reservoir at Malheur county ,43.6800407751595,-117.323529115233
OR,41045,Little Sandy Reservoir at Malheur county ,43.0443267678173,-117.133176870259
OR,41019,Heart Lake at Douglas county ,42.9592833844878,-122.922593016776
OR,41047,Silver King Lake at Marion county ,44.8703418959598,-122.148108489612
OR,41005,Big Slide Lake at Clackamas county ,44.8890517777006,-122.085995991135
OR,41005,Dickey Lake at Clackamas county ,44.8879207015047,-122.104438284026
OR,41005,Joyce Lake at Clackamas county ,44.9451144984546,-122.248850764247
OR,41045,Four Points Reservoir at Malheur county ,43.7111832036103,-117.146120350302
OR,41045,Poison Spring Reservoir at Malheur county ,43.7090338545868,-117.401034499737
OR,41045,Mills Dam Number 3 at Malheur county ,43.7189386250517,-117.354697533932
OR,41045,Lowe Reservoir at Malheur county ,43.7209938405893,-117.354549375605
OR,41041,Salishan Lake at Lincoln county ,44.8866531166803,-124.025529464572
OR,41069,Fred Creek Lake at Wheeler county ,44.4705657874124,-119.834980677852
OR,41039,Green Lake at Lane county ,43.7261915968807,-122.068627098104
OR,41039,Kinglet Lake at Lane county ,43.7449281658661,-122.072840509192
OR,41039,Zircon Lake at Lane county ,43.7459915735237,-122.076163519106
OR,41039,Emerald Lake at Lane county ,43.744309139241,-122.085931454003
OR,41017,Bobby Lake at Deschutes county ,43.661236720468,-121.977014149088
OR,41039,Cervus Lake at Lane county ,43.7884087332009,-122.017009831211
OR,41039,Loon Lake at Lane county ,43.8680157142101,-124.136539181807
OR,41039,Siltcoos Lagoon at Lane county ,43.8791913081541,-124.143736754362
OR,41039,Erhart Lake at Lane county ,43.8708968962171,-124.131699828284
OR,41039,Georgia Laka at Lane county ,43.8730423903959,-124.130929549559
OR,41031,Pelton Regulating Reservoir at Jefferson county ,44.7155795477375,-121.242503608381
OR,41045,Canyon Reservoir at Malheur county ,43.7797827343699,-117.276343064627
OR,41045,Yellowjacket Reservoir at Malheur county ,43.7672166239103,-117.27715749878
OR,41031,View Lake at Jefferson county ,44.7933966248213,-121.798597785869
OR,41031,Francis Lake at Jefferson county ,44.7648920355475,-121.74451569317
OR,41031,Lake Sarah at Jefferson county ,44.7625314738807,-121.752897749353
OR,41031,Boulder Lake at Jefferson county ,44.7931037115356,-121.726506247073
OR,41031,Lake Hazel at Jefferson county ,44.7883300085124,-121.767314775383
OR,41031,Lake Mary at Jefferson county ,44.7933412781961,-121.764073840044
OR,41031,Lake Alice at Jefferson county ,44.7894801006873,-121.76075073033
OR,41031,Lake Marie at Jefferson county ,44.7908283498608,-121.763114105101
OR,41031,Trout Lake at Jefferson county ,44.8005078010844,-121.735178823927
OR,41041,Eckman Lake at Lincoln county ,44.4123434359899,-124.033440071527
OR,41039,Alder Lake at Lane county ,44.0706831559507,-124.103671633816
OR,41045,Two Forks Check Reservoir at Malheur county ,43.8118170367209,-117.296773606005
OR,41045,Lower Cow Reservoir at Malheur county ,43.8104621469791,-117.278687659516
OR,41045,Upper Cow Reservoir at Malheur county ,43.7936534486571,-117.309336919487
OR,41017,Meadow Grass Lake at Deschutes county ,44.3725521414983,-121.668293037054
OR,41017,Homestead Lake at Deschutes county ,44.3487948022229,-121.647178738629
OR,41017,Gosling Lake at Deschutes county ,44.3486908418231,-121.649137508363
OR,41017,Hazard Lake at Deschutes county ,44.3489725526834,-121.650555626291
OR,41017,Lupine Lake at Deschutes county ,44.347681964412,-121.642375862385
OR,41017,Heron Lake at Deschutes county ,44.348809776906,-121.636817280531
OR,41045,Bully Creek Reservoir at Malheur county ,44.0266596495107,-117.413960890765
OR,41027,Tanner Lake at Hood River county ,45.5645157469748,-121.901587017249
OR,41023,Little Mud Lake at Grant county ,44.2813790172148,-118.663113467901
OR,41023,Mud Lake at Grant county ,44.2759559312493,-118.660031121019
OR,41013,Hickey Reservoir at Crook county ,44.3191870100992,-120.158757937439
OR,41013,Round Prairie Reservoir at Crook county ,44.3048220853506,-120.182949524217
OR,41013,Long Prairie Reservoir at Crook county ,44.2975228124852,-120.212096587342
OR,41013,Marshy Reservoir at Crook county ,44.2019860219809,-119.833002786178
OR,41013,Palmer Reservoir at Crook county ,44.1489084939671,-119.759015770374
OR,41005,Teasel Creek Reservoir at Clackamas county ,45.1057256637993,-122.580406490917
OR,41053,Hoekstre Reservoir at Polk county ,44.9964887179444,-123.34096653849
OR,41053,Classen Reservoir at Polk county ,44.9887777692713,-123.355471229019
OR,41053,Martin Reservoir at Polk county ,45.0254000273993,-123.214652446507
OR,41071,Von Reservoir at Yamhill county ,45.2964892836501,-123.325531854939
OR,41053,Burns Reservoir at Polk county ,45.0724586495561,-123.521050143417
OR,41043,Tadmor Lake at Linn county ,44.4686847635557,-122.650439491091
OR,41039,Lorin Lake at Lane county ,43.6488167632991,-122.073481501035
OR,41039,Jo Ann Lake at Lane county ,43.6449970259612,-122.066845461911
OR,41039,Upper Marilyn Lake at Lane county ,43.6204551387484,-122.051219097572
OR,41039,Lower Marilyn Lake at Lane county ,43.6215450773167,-122.056288169619
OR,41039,Verde Lake at Lane county ,43.6443094705091,-122.092431217144
OR,41039,Birthday Lake at Lane county ,43.6438428647427,-122.088472036968
OR,41039,Lower Island Lake at Lane county ,43.6474015091063,-122.086878158573
OR,41039,Upper Island Lake at Lane county ,43.6498924982993,-122.087094740626
OR,41039,Lopez Lake at Lane county ,43.5899632372126,-122.151716253817
OR,41039,Abernethy Lake at Lane county ,43.6021997461828,-122.101207683887
OR,41039,Lucas Lake at Lane county ,43.6430697230704,-122.128897570932
OR,41053,Alsip Reservoir at Polk county ,44.8656048633945,-123.300372149813
OR,41053,South Slough Pond at Polk county ,44.95359804293,-123.257545959664
OR,41047,Willow Lake at Marion county ,45.0042316482196,-123.060257488685
OR,41047,Keesneck Lake at Marion county ,44.7835827513974,-123.121180210177
OR,41039,Noti Creek Reservoir at Lane county ,44.0213362807705,-123.431312730574
OR,41061,Glacier Lake at Union county ,45.1623233319734,-117.284682689407
OR,41037,Schoolhouse Lake at Lake county ,42.9625739990753,-120.714444174856
OR,41037,Dutchy Lake at Lake county ,42.9667617297359,-120.770153736668
OR,41037,Rest Lake at Lake county ,42.9575975399017,-120.754576902515
OR,41037,Leyna Lakes at Lake county ,42.949506268905,-120.784792180136
OR,41037,Jacks Lakes at Lake county ,42.9513006617262,-120.79157357911
OR,41037,Summer Lake at Lake county ,42.8270083290059,-120.749064941201
OR,41037,Ana Reservoir at Lake county ,42.9970836805599,-120.755748010233
OR,41045,East Cow Hollow Reservoir at Malheur county ,43.8918336874078,-117.181990730226
OR,41045,Johnston Gulch Reservoir at Malheur county ,43.9039841666621,-117.255308006983
OR,41045,Lincoln Bench Reservoir at Malheur county ,43.9070420568852,-117.120760978597
OR,41045,Games Reservoir at Malheur county ,43.8961986590139,-117.244247505317
OR,41047,Turner Lake at Marion county ,44.8584652016557,-122.956432288625
OR,41035,Boulder Pond at Klamath county ,42.6629648482747,-122.239941447813
OR,41045,Findley Reservoir at Malheur county ,43.9734789299107,-117.177665308275
OR,41011,Johnson Mill Pond at Coos county ,43.1325197449654,-124.184515658094
OR,41069,Painted Hills Reservoir at Wheeler county ,44.6667467593209,-120.278112581024
OR,41069,Fopiano Reservoir at Wheeler county ,44.5874734709508,-119.946023805319
OR,41029,Modoc Reservoir at Jackson county ,42.4598261140051,-122.890350138814
OR,41025,Ten Cent Lake at Harney county ,42.9931561623645,-118.284933879356
OR,41029,Lester James Reservoir Number 3 at Jackson county ,42.4882686944488,-122.946294136611
OR,41029,Lester James Reservoir at Jackson county ,42.48891313564,-122.952638565816
OR,41047,Wright Sump at Marion county ,44.9962040635487,-122.819133552055
OR,41035,Fly Lake at Klamath county ,42.5807256332549,-122.222609877841
OR,41035,Lake Ruden at Klamath county ,42.5790441268167,-122.203101588385
OR,41035,Isherwood Lake at Klamath county ,42.5725788855563,-122.201618188161
OR,41035,Lake Liza at Klamath county ,42.5732842607009,-122.205198820025
OR,41035,Lake Elizabeth at Klamath county ,42.5694075754737,-122.201709572072
OR,41051,School Section Lake at Multnomah county ,45.6551631267093,-122.806013087254
OR,41045,Inspiration Reservoir at Malheur county ,42.2282788101988,-117.466711124329
OR,41045,Emmets Hole at Malheur county ,42.4343774458747,-117.336808370548
OR,41045,Peacock Pond Reservoir at Malheur county ,42.5592476095488,-117.470018804832
OR,41045,Skull Creek Reservoir at Malheur county ,42.6857062568986,-117.317848142134
OR,41045,Eiguren Reservoir at Malheur county ,42.6636951383807,-117.293316244253
OR,41025,Oriana Reservoir at Harney county ,42.1023049413768,-118.386475016611
OR,41037,School Section Lake at Lake county ,42.2690189054067,-119.668306912319
OR,41037,Jack Lake at Lake county ,42.2477899295662,-119.621408454833
OR,41037,Moon Lake at Lake county ,42.2326945424776,-119.633044055365
OR,41037,Weed Lake at Lake county ,42.2253234462019,-119.624401167739
OR,41043,Periwinkle Lake at Linn county ,44.6196263023715,-123.078311045518
OR,41037,Wilson Lake at Lake county ,42.4001761008837,-120.27128206295
OR,41037,Boggy Lake at Lake county ,42.3966719851188,-120.262699969462
OR,41063,Warm Lake at Wallowa county ,45.0896171222924,-117.07841388785
OR,41063,Billy Jones Lake at Wallowa county ,45.2502112445051,-117.350038912229
OR,41063,Lake Francis at Wallowa county ,45.0821794277413,-117.086256350889
OR,41061,Moon Lake at Union county ,45.1379386837746,-117.321756979169
OR,41061,Little Pop Lake at Union county ,45.1339151301491,-117.350941298499
OR,41061,Pop Lake at Union county ,45.1344078725752,-117.371050046404
OR,41063,Hazel Lake at Wallowa county ,45.2438809513507,-117.461158039037
OR,41061,Cached Lake at Union county ,45.1181672090202,-117.368363924936
OR,41023,Roosevelt Lake at Grant county ,44.3987545301699,-119.435783973929
OR,41023,Stewart Lake at Grant county ,44.3931942962504,-119.437669340457
OR,41023,Magone Lake at Grant county ,44.5490057619205,-118.911261022494
OR,41039,Blair Lake at Lane county ,43.8345207937455,-122.239327920941
OR,41039,Memaloose Lake at Lane county ,43.8490183861752,-122.315664989847
OR,41015,Ferry Creek Reservoir at Curry county ,42.0744563531553,-124.272543695098
OR,41051,Memorial Fountain at Multnomah county ,45.5327282656534,-122.669027702775
OR,41063,Deduct Pond at Wallowa county ,45.9598079108084,-117.968718183421
OR,41037,Halfway Lake at Lake county ,43.129427848591,-121.237755454998
OR,41035,Crescent Lake at Klamath county ,43.4775082562236,-121.990575792359
OR,41035,Oldenberg Lake at Klamath county ,43.4150526883574,-121.999234621538
OR,41035,Bingham Lakes at Klamath county ,43.4270086732384,-122.009429017882
OR,41035,Pinewan Lake at Klamath county ,43.4477170401214,-122.013339269928
OR,41001,Goodrich Lake at Baker county ,44.8096440000642,-118.060255382355
OR,41001,Bucket Lake at Baker county ,44.8202633221015,-118.1204681123
OR,41001,Rock Creek Lake at Baker county ,44.8222366420964,-118.109370536377
OR,41001,Killamacue Lake at Baker county ,44.8739490136497,-118.14504645694
OR,41001,Hoffer Lakes at Baker county ,44.9498332072514,-118.236484699129
OR,41039,Sandy Lake at Lane county ,43.9637012490855,-121.893380186935
OR,41031,Cigar Lake at Jefferson county ,44.8025603389113,-121.813392377484
OR,41013,Mill percolation pond at Crook county ,44.3188329357582,-120.841901922732
OR,41011,Smith Reservoir at Coos county ,43.3482225125258,-124.189776924209
OR,41029,Hilldale Reservoir at Jackson county ,42.2776410476549,-122.800511680273
OR,41031,Eloise Lake at Jefferson county ,44.8019350724755,-121.808531639131
OR,41047,Ring Lake at Marion county ,44.8060744624211,-121.814157641103
OR,41047,Nekbobets Lake at Marion county ,44.8081769937913,-121.814630691046
OR,41061,Fairgrounds Pond at Union county ,45.3458131729455,-118.107138282606
OR,41061,Hot Lake Springs at Union county ,45.244379346611,-117.959442034063
OR,41025,Hines Mill Pond at Harney county ,43.5455865341683,-119.081749453085
OR,41035,Tsuga Lake at Klamath county ,42.6092207790639,-122.204658907063
OR,41035,Lake Florence at Klamath county ,42.5758558436953,-122.206032819551
OR,41035,Punky Lake at Klamath county ,42.5633202642266,-122.199803028859
OR,41035,Notasha Lake at Klamath county ,42.5678121318546,-122.202750001437
OR,41035,Mosquito Lake at Klamath county ,42.5756264091291,-122.186744102266
OR,41035,Deer Lake at Klamath county ,42.5636131579696,-122.211325825239
OR,41035,Martin Lake at Klamath county ,42.6158267791727,-122.206827184567
OR,41035,Wind Lake at Klamath county ,42.6145935934903,-122.209032060839
OR,41035,Snow Lakes at Klamath county ,42.6124811009424,-122.20647666641
OR,41035,Puck Lakes at Klamath county ,42.6273546086262,-122.175909068744
OR,41025,Borax Lake at Harney county ,42.3274140338272,-118.60294759011
OR,41025,Lower Borax Lake Reservoir at Harney county ,42.3245316417803,-118.608659414192
OR,41005,Corbia Lake at Clackamas county ,44.9794020653079,-122.471318183313
OR,41005,Pelkey Lake at Clackamas county ,44.9809438234138,-122.477405858082
OR,41027,Black Lake at Hood River county ,45.6152469413435,-121.761893416552
OR,41019,Hemlock Lake at Douglas county ,43.1880806275114,-122.702256932888
OR,41027,Bear Lake at Hood River county ,45.6498298292796,-121.734188222696
OR,41067,Bailey Reservoir at Washington county ,45.4879415904026,-122.996366224597
OR,41039,Fork Basin at Lane county ,44.0502186979052,-123.27946792705
OR,41039,Fern Ridge Runoff at Lane county ,44.0511557269457,-123.305537894099
OR,41039,Weyerhaeuser Road pond at Lane county ,44.0391810154342,-122.9352317946
OR,41039,Irrigation Reservoir at Lane county ,44.1412103088991,-123.204517224639
OR,41039,Eugene Lake at Lane county ,44.141436006898,-123.201103867172
OR,41039,Hulbert Lake at Lane county ,44.2739871717708,-123.254076120308
OR,41067,Hofer Pond at Washington county ,45.6378998334602,-123.162901473186
OR,41001,Stoddard Reservoir at Baker county ,44.9143800320601,-117.318149053994
OR,41047,Eoff Reservoir at Marion county ,44.8152535125844,-123.034537730071
OR,41067,Bastion Reservoir at Washington county ,45.50691365345,-122.912361117156
OR,41025,Tuck Reservoir at Harney county ,44.0267504064593,-118.432741373936
OR,41025,Tamarack Reservoir at Harney county ,44.0275269962498,-118.387667735269
OR,41025,Shorty Reservoir at Harney county ,44.0085270230051,-118.397049339336
OR,41065,Blue Lake at Wasco county ,44.8428175693585,-121.740427556234
OR,41035,Lake Janice at Klamath county ,42.4397436650698,-122.24819507104
OR,41029,Hobart Lake at Jackson county ,42.0978087802674,-122.480700817605
