st2,GEOID,lake,lat,lon
SC,45051,Long Bay Lake at Horry county ,33.6373094210075,-78.9433478972202
SC,45051,St. Julien Lake at Horry county ,33.6358285965332,-78.9450812753794
SC,45051,Dogwood Lake at Horry county ,33.615657798944,-78.9677700229049
SC,45051,Floral Lake at Horry county ,33.6027416655059,-78.9778195912616
SC,45051,Stanley Lake at Horry county ,33.5806228589763,-79.0171296584309
SC,45043,Sandpiper Pond at Georgetown county ,33.5108212628898,-79.0565797425201
SC,45043,Mullet Pond at Georgetown county ,33.50787173903,-79.0693275303019
SC,45043,Mallard Pond at Georgetown county ,33.5042659511931,-79.0718954987742
SC,45043,Flagg Pond at Georgetown county ,33.4897826101397,-79.0870805445479
SC,45051,Cherry Grove Inlet at Horry county ,33.8322732301768,-78.6329816432892
SC,45091,Williams Lake at York county ,34.9123159506623,-80.9269548866253
SC,45091,Ellis Pond at York county ,34.9289552595085,-80.9460345048185
SC,45091,Gibson Pond at York county ,35.0447826870952,-80.9811481024035
SC,45091,Lake Patricia at York county ,35.0329791833243,-80.9556793046814
SC,45091,Lake Haigler at York county ,35.0337061378194,-80.9425461247576
SC,45023,Fishing Creek Lake at Chester county ,34.5922951993573,-80.8880313509913
SC,45091,Airport Pond at York county ,35.0226598366496,-80.9511568993107
SC,45091,Fishing Creek Watershed Dam Number One at York county ,35.0061763478622,-81.203968447078
SC,45091,Mims Lake at York county ,34.9827283857185,-80.9351005894567
SC,45057,Burnetts Pond at Lancaster county ,34.7436007177476,-80.7023594776633
SC,45023,Cedar Creek Reservoir at Chester county ,34.5539147711665,-80.8782783028278
SC,45057,Nesbits Pond at Lancaster county ,34.8622001148084,-80.838504347698
SC,45057,Cane Creek Watershed Site 16 at Lancaster county ,34.7701634508626,-80.6655805994417
SC,45057,Betheas Pond at Lancaster county ,34.6999403116017,-80.7169506632937
SC,45091,McCorkle Pond at York county ,34.9920557477941,-80.9315910407193
SC,45091,Winthrop Lake at York county ,34.9424838754605,-81.0151931471223
SC,45057,Jackson Pond at Lancaster county ,34.8929183539764,-80.8021188921873
SC,45057,Cedar Pines Lake at Lancaster county ,34.736540186685,-80.8259322884335
SC,45057,Cane Creek Watershed Site Seven at Lancaster county ,34.7805268925592,-80.6923986073229
SC,45057,Culps Pond at Lancaster county ,34.8245542308528,-80.8043452486458
SC,45091,Forest Lake at York county ,35.0606537993168,-80.9423015226105
SC,45091,Willis Pond at York county ,34.9757888406451,-81.1114975544544
SC,45091,Lake Katherine at York county ,35.0486301017991,-80.9316884416296
SC,45057,Harpers Pond at Lancaster county ,34.6896150358286,-80.7235947945167
SC,45091,Stallings Pond at York county ,35.0229050829266,-80.9651268791704
SC,45057,Belks Pond at Lancaster county ,34.7898027378122,-80.6987552701516
SC,45091,Lake Elliott at York county ,35.0183311999714,-80.9703577823784
SC,45023,Great Falls Reservoir at Chester county ,34.5881979183131,-80.8909516600805
SC,45091,Fishing Creek WCD Site Number Two at York county ,34.9601962839968,-81.2192505567458
SC,45091,Reids Pool at York county ,34.8353573521727,-81.0061919225853
SC,45057,Rowells Pond at Lancaster county ,34.7819899231278,-80.6368114389253
SC,45013,Blue Heron Lake at Beaufort county ,32.3258591727917,-80.467057124481
SC,45013,Fiddlers Trace Lake at Beaufort county ,32.332062046237,-80.470815538042
SC,45055,Kirkland Pond at Kershaw county ,34.1553945635193,-80.7556913530416
SC,45013,Stream off Old House Creek at Beaufort county ,32.3351523975923,-80.4747877830413
SC,45055,Kendall Lake at Kershaw county ,34.261656535783,-80.5910887721591
SC,45079,Sesquicentennial Lake at Richland county ,34.0853736028578,-80.9044617988073
SC,45027,Dingle Pond at Clarendon county ,33.5183533863497,-80.4173764571933
SC,45035,Reflection Pool at Dorchester county ,32.9013992972505,-80.1384135478992
SC,45087,Foster Park Lake at Union county ,34.7246153523279,-81.6130271382168
SC,45087,John D. Long Lake at Union county ,34.7748936856426,-81.5106356688709
SC,45037,Lick Fork Lake at Edgefield county ,33.7280738441551,-82.0420090268495
SC,45085,Mill Creek Park Pond at Sumter county ,33.7364158028873,-80.5224836104297
SC,45055,Adams Mill Pond at Kershaw county ,34.2844098078996,-80.5211368432661
SC,45085,Christmas Mill Lake at Sumter county ,33.7992303147206,-80.5319693836111
SC,45051,Grand Lake at Horry county ,33.6680569161239,-78.942098227354
SC,45055,Colonial Lake at Kershaw county ,34.3151277817046,-80.5986780898381
SC,45025,Wood Duck Pond at Chesterfield county ,34.5552794115876,-79.9381494659626
SC,45025,Brown Springs Pond at Chesterfield county ,34.5397814338739,-80.0250088680093
SC,45025,Flory Pond at Chesterfield county ,34.5324026690965,-80.0826658432326
SC,45025,Scott Pond at Chesterfield county ,34.5195738838889,-80.1153760396708
SC,45025,Middendorf Pond at Chesterfield county ,34.5433698418782,-80.1452485773972
SC,45025,Hunter Pond at Chesterfield county ,34.5691784433529,-80.0834402642475
SC,45015,Longleaf Otter Pond at Berkeley county ,32.9991594474681,-80.013209499284
SC,45079,Boyden Arbor Pond at Richland county ,34.0374662221484,-80.9326811288807
SC,45003,Black Gum Pond at Aiken county ,33.5514766171853,-81.7623886627128
SC,45051,Lewis Pond at Horry county ,33.7991334973369,-78.7443296941522
SC,45019,Alberta Sottile Long Lake at Charleston county ,32.7802045383702,-79.9489507992273
SC,45085,Old Levi Mill Lake at Sumter county ,33.8037852242078,-80.5462424856413
SC,45085,Mikell Pond at Sumter county ,33.9620627939935,-80.5658116096146
SC,45075,J. W. Smoaks Pond at Orangeburg county ,33.5265865197735,-80.9351015418681
SC,45079,Spring Lake at Richland county ,34.0411803323491,-80.9565265882874
SC,45019,Gray Bay at Charleston county ,32.8127954538416,-79.7788845136856
SC,45075,Santee Shores Pond at Orangeburg county ,33.4878891274934,-80.4855147628943
SC,45089,Wee Tee Lake at Williamsburg county ,33.3736132533693,-79.7670090700452
SC,45079,Pinewood Lake / Caughmans Pond at Richland county ,33.9468052299014,-80.9115625155223
SC,45055,Cooks Pond at Kershaw county ,34.1529820793107,-80.7741800505782
SC,45055,Cranshaw Pond at Kershaw county ,34.2083654253627,-80.7858286311031
SC,45055,Taylor Pond at Kershaw county ,34.2090332576115,-80.7656700916225
SC,45055,House Pond at Kershaw county ,34.2052884948955,-80.5895722637754
SC,45055,Mulberry Picnic Pond at Kershaw county ,34.1967513300137,-80.5633750436599
SC,45079,Legion Lake at Richland county ,34.1534369143764,-80.8749059447496
SC,45079,Bridge Creek at Richland county ,34.156414829286,-80.8676392991216
SC,45013,Crystal Lake at Beaufort county ,32.4107976500579,-80.6577147312476
SC,45013,Nini Chapin Pond at Beaufort county ,32.2465526586429,-80.7586520819181
SC,45019,Morgan Creek Docks at Charleston county ,32.808467662904,-79.7495849330997
SC,45003,Hallmans Pond at Aiken county ,33.4931890500191,-81.4292818234145
SC,45041,Butterfly Lake at Florence county ,34.1548645147953,-79.7752248744146
SC,45041,Celebration Lake at Florence county ,34.169642841515,-79.8264057077042
SC,45079,Bells Pond at Richland county ,34.0918885965318,-80.8692891691276
SC,45041,Goodson Pond at Florence county ,34.2828598901726,-79.6976395540055
SC,45037,Slade Lake at Edgefield county ,33.7796910050064,-81.9151204783405
SC,45003,Graniteville Pond Two at Aiken county ,33.5768782333675,-81.8022291932364
SC,45003,Flat Rock Pond at Aiken county ,33.584507838784,-81.8105824038228
SC,45003,Carolina Bay at Aiken county ,33.5318727672457,-81.7211552463792
SC,45049,Lake George Warren at Hampton county ,32.8317384428933,-81.1722637783974
SC,45085,Lower Deerwood Lake at Sumter county ,33.9314904226781,-80.3966566476929
SC,45085,Upper Deerwood Lake at Sumter county ,33.9322304326343,-80.399202611736
SC,45019,Bullyard Sound at Charleston county ,32.8483202536998,-79.7268818426273
SC,45019,Mark Bay at Charleston county ,32.8837284878683,-79.6825960613337
SC,45075,Fogle Mill Pond at Orangeburg county ,33.4183256208732,-81.0041258546489
SC,45045,Cleveland Fish Hatchery at Greenville county ,35.1254670637995,-82.5720755715584
SC,45063,Sterling Lake at Lexington county ,34.0207159527743,-81.2709731906518
SC,45085,Culp Pond at Sumter county ,33.7037253622542,-80.5273769898305
SC,45017,Struckman Pond at Calhoun county ,33.7697404930932,-80.9415126537568
SC,45073,Bad Creek Reservoir at Oconee county ,35.0125596129624,-83.017091252802
SC,45017,Calmont Pond at Calhoun county ,33.7674318637279,-81.0380341145582
SC,45079,Duffies Pond at Richland county ,33.8431828764485,-80.8471384630918
SC,45055,Powell Pond at Kershaw county ,34.1064631830536,-80.7518148168945
SC,45011,Stringfellow Mill Pond at Barnwell county ,33.3872027492013,-81.506920755258
SC,45003,Aiken State Park Lake at Aiken county ,33.54973411077,-81.4824385528334
SC,45019,Lake Ben Tatum at Charleston county ,32.7819860511432,-79.8692088774536
SC,45013,Federal Street Pond at Beaufort county ,32.4338859506432,-80.6675243259815
SC,45039,Miller Pond at Fairfield county ,34.5487929531726,-81.2576204226685
SC,45079,Stevensons Lake at Richland county ,34.1302836670081,-80.9764372425679
SC,45079,Crescent Lake at Richland county ,34.135623952603,-80.9733437948447
SC,45079,Hidden Acres Pond at Richland county ,34.139290168733,-80.9760956951895
SC,45079,Drexel Lake at Richland county ,34.0628006211859,-80.9156236145092
SC,45071,Greenslades Pond at Newberry county ,34.2795154802427,-81.5580667303971
SC,45083,Tyger Lake at Spartanburg county ,34.9446903924901,-82.05908516038
SC,45087,Union Water Works Pond at Union county ,34.7268044251168,-81.6158777927065
SC,45091,Upper York Reservoir at York county ,35.0042448997571,-81.2525165326271
SC,45045,Echo Lake at Greenville county ,35.0703827176331,-82.5201544306377
SC,45047,Star Fort Pond at Greenwood county ,34.1471316502481,-82.009326338304
SC,45019,Hamlin Sound at Charleston county ,32.8333344243387,-79.7760364507034
SC,45051,Allsbrook Pond at Horry county ,34.0033578549166,-78.9751062300584
SC,45019,Pintail Pond at Charleston county ,32.6147713776567,-80.0559726556074
SC,45019,Boret Pond at Charleston county ,32.6174317270368,-80.0540847044525
SC,45091,Mill Creek Falls Pond at York county ,35.1337812774278,-81.0910390651463
SC,45017,Lake Inspiration at Calhoun county ,33.6724623920741,-80.7769299911942
SC,45059,Lake Rabon at Laurens county ,34.4934112748204,-82.1411831773281
SC,45041,Forest Lake at Florence county ,34.1568165854584,-79.8423622886487
SC,45079,Carys Lakes at Richland county ,34.0548879261504,-80.9552770859383
SC,45079,Village Lake at Richland county ,34.0902862121162,-80.9838790623713
SC,45079,Boyds Pond Two at Richland county ,34.097733462389,-80.8839853330892
SC,45079,Burnside Lake at Richland county ,34.0560016823899,-80.9672599218543
SC,45079,Hughes Pond at Richland county ,34.0956454063807,-80.8638118624223
SC,45079,Rockyford Lake at Richland county ,34.0390054883368,-80.949399485636
SC,45079,Spring Valley Lake at Richland county ,34.1034541092107,-80.9241057497854
SC,45079,Adams Pond at Richland county ,33.9187679083383,-80.9466162141255
SC,45079,Reveres Pond at Richland county ,33.9450259671644,-80.8654795241455
SC,45063,Lemon Pond at Lexington county ,33.96135416022,-81.117082716905
SC,45055,Fredricksburg Pond at Kershaw county ,34.1948894646965,-80.6922388440493
SC,45055,Sandy Hill Pond Number One at Kershaw county ,34.291657503535,-80.6242051416918
SC,45055,Sandy Hill Pond Number Two at Kershaw county ,34.2891243691567,-80.6261228014665
SC,45031,Kington Lake at Darlington county ,34.3825666569389,-80.1840333216479
SC,45057,Baxley Pond at Lancaster county ,34.5446673891993,-80.5673518632379
SC,45057,Horton Pond at Lancaster county ,34.5748590868303,-80.6792492430178
SC,45079,Reflection Pool at Richland county ,33.9959446998405,-81.0284738995654
SC,45043,Ammons Pond at Georgetown county ,33.5160393622823,-79.0892528010353
SC,45043,Dogwood Pond at Georgetown county ,33.5199054591856,-79.0969521232661
SC,45015,Lake Merkel at Berkeley county ,33.2089218105126,-80.3052466248333
SC,45045,Trammell Lake at Greenville county ,35.1329500707685,-82.5330494877613
SC,45045,Half Mile Lake at Greenville county ,34.9047089839573,-82.3760927717125
SC,45051,Cypress Lake at Horry county ,33.8415767788043,-78.7054227194872
SC,45063,Feigles Pond at Lexington county ,33.8509700558645,-81.178748336966
SC,45063,Sox Ponds at Lexington county ,33.945979879752,-81.140930806769
SC,45019,Whitney Lake at Charleston county ,32.7443049420171,-80.0539389340567
SC,45085,White Oak Slash Lake at Sumter county ,34.08660945442,-80.6043021771847
SC,45079,Wildewood Pond Number Five at Richland county ,34.10371996907,-80.8855293213362
SC,45079,Clark Pond at Richland county ,34.0628245894063,-80.881227075264
SC,45063,Shealy's Pond at Lexington county ,33.8620374164529,-81.2351245314841
SC,45003,Chalk Hill Millpond at Aiken county ,33.7412209715301,-81.4312223094989
SC,45063,Lake Quail Valley at Lexington county ,34.0745837691637,-81.1686077596562
SC,45079,Windsor Lake at Richland county ,34.0718079733215,-80.9328565534198
SC,45063,Ridgells Pond at Lexington county ,33.8028843968585,-81.457345485668
SC,45085,Oakland Pond at Sumter county ,33.9877296125009,-80.5018725561785
SC,45045,Holiday Lake at Greenville county ,35.0809257815832,-82.5710876141964
SC,45079,Pine Springs Pond at Richland county ,34.1165376391664,-80.9196389229571
SC,45003,Burdens Deep Pond at Aiken county ,33.4783772553852,-81.7420166108068
SC,45079,Forest Lake at Richland county ,34.0287188506865,-80.9559373845674
SC,45079,F Coopers Pond at Richland county ,34.1162194670445,-80.8115041105981
SC,45085,Dow Lake at Sumter county ,33.7656830863931,-80.5593336581727
SC,45051,Retention Pond at Horry county ,33.6602153897565,-79.0048224067803
SC,45085,Campbell Pond at Sumter county ,33.8192488173144,-80.5300175393913
SC,45045,Cardinal Lake at Greenville county ,34.9421576912735,-82.3666016697659
SC,45079,Boyds Pond at Richland county ,33.9224226056825,-80.7567686381589
SC,45079,Clarkson Pond at Richland county ,33.8709800153554,-80.8247857927559
SC,45079,Krelldire Pond at Richland county ,33.9329824719835,-80.7027463827413
SC,45013,Wexford Harbour at Beaufort county ,32.170835082254,-80.760996337476
SC,45079,Ruthledges Pond at Richland county ,34.0842385680643,-80.8725308351739
SC,45063,Geiger Pond at Lexington county ,33.8732514591863,-81.059658060734
SC,45063,Sweet Bay Pond at Lexington county ,33.875569965343,-81.0548478565084
SC,45063,Gunters Pond at Lexington county ,33.7421000161383,-81.3132946983363
SC,45079,Moores Pond at Richland county ,34.1023619254665,-80.9669953878517
SC,45045,Hunts Lake at Greenville county ,34.9367339649967,-82.5173646146642
SC,45045,Lake Wattacoo at Greenville county ,35.0861483400255,-82.5792504915639
SC,45073,Prater Pond at Oconee county ,34.6160529867815,-83.0414637025997
SC,45063,Redmond Pond at Lexington county ,33.8509209580866,-81.2381507761267
SC,45063,Cones Pond at Lexington county ,33.8049767384625,-81.4707895960926
SC,45051,Starbuck Lake at Horry county ,33.5930958000596,-79.0521281323567
SC,45079,Captain Jims Pond at Richland county ,33.9670258767043,-80.8915105632545
SC,45079,Lower Legion Lake at Richland county ,33.9984094137425,-80.9307323001299
SC,45079,Upper Legion Lake at Richland county ,34.0000074640119,-80.9301002837533
SC,45079,Lake Columbia at Richland county ,34.1753650139823,-80.9264691382056
SC,45079,Lake Carolina at Richland county ,34.1748077646861,-80.8865475110385
SC,45079,Rymers Pond at Richland county ,34.1939196122236,-80.9524091379248
SC,45047,A M Tucks Pond at Greenwood county ,34.1008254400681,-82.2599612659381
SC,45051,Bumper Boats at Horry county ,33.6807475747266,-78.8925057237394
SC,45045,Lake Fairfield at Greenville county ,34.8766645256955,-82.3447521001035
SC,45045,Rutledge Lake at Greenville county ,34.9118888880154,-82.5010465151883
SC,45077,Saluda Lake at Pickens county ,34.8710489940595,-82.4887630962609
SC,45059,Duncan Creek Watershed Two Reservoir at Laurens county ,34.5057627729042,-81.8828415087136
SC,45079,My Pond at Richland county ,34.1555309165187,-81.0003364195376
SC,45011,Lake Cynthia at Barnwell county ,33.3359438656502,-81.2689002696089
SC,45019,Vendue Fountain at Charleston county ,32.7789748967145,-79.9254485330969
SC,45071,Eptings Pond at Newberry county ,34.2213489828231,-81.4626310150191
SC,45045,Holly Pot Lake at Greenville county ,35.0862495977364,-82.5694844433814
SC,45085,Booths Pond at Sumter county ,33.9771439377757,-80.4419589512519
SC,45085,Shaw Golf Course Pond Number 1 at Sumter county ,33.9795361418041,-80.4786237760218
SC,45079,Springwood Lake at Richland county ,34.0783610577941,-80.9516866748969
SC,45087,Adams Lake at Union county ,34.7898868827757,-81.5176157452499
SC,45013,Lake Joe at Beaufort county ,32.1405794833711,-80.7778860282696
SC,45013,Lake Chapin at Beaufort county ,32.1382802333944,-80.7769101929126
SC,45013,Lake Thomas at Beaufort county ,32.1412873624062,-80.7748435710392
SC,45013,Wood Duck Pond at Beaufort county ,32.1423812001414,-80.7730156094388
SC,45013,Lake Mary at Beaufort county ,32.1437570308301,-80.7692293913927
SC,45079,North Springs Lake at Richland county ,34.1335129464518,-80.8908377517274
SC,45079,Lake Egret at Richland county ,34.1224668010266,-80.9070298149778
SC,45079,Clark's Lake at Richland county ,34.1204639529211,-80.9011266952727
SC,45079,Dupre Pond at Richland county ,34.0940165425889,-80.813935807874
SC,45079,Rotureau at Richland county ,34.1169858231569,-80.8481398694055
SC,45077,Lake Oolenoy at Pickens county ,35.0189812633296,-82.6931727008325
SC,45079,Semmes Lake at Richland county ,34.0064915860726,-80.9408614159685
SC,45051,Flagpole Pond at Horry county ,33.7563755630487,-78.8618906653965
SC,45077,Lake Barbara at Pickens county ,35.0018267762438,-82.74856865821
SC,45019,Dry Dock 1 at Charleston county ,32.8633338262873,-79.9669078278156
SC,45019,Dry Dock 2 at Charleston county ,32.8625243187745,-79.9665886872788
SC,45045,Oak Grove Lake at Greenville county ,34.8447579645267,-82.2855845534276
SC,45045,Furman Lake at Greenville county ,34.9271315353793,-82.440763500975
SC,45017,Edens Small Pond at Calhoun county ,33.7844246962031,-81.0369003111969
SC,45017,Baker Mill Pond at Calhoun county ,33.7879661215899,-81.0329418193087
SC,45055,Boykin Millpond at Kershaw county ,34.1341537015218,-80.5749690740602
SC,45045,Independence Corporate Park Pond at Greenville county ,34.8363571368603,-82.2991545565315
SC,45079,Wise Lake at Richland county ,33.8149798956992,-80.8281032741748
SC,45063,Durham Pond at Lexington county ,33.8960881361311,-81.2358450087137
SC,45037,Millers Pond at Edgefield county ,33.6823618867053,-81.8934976521909
SC,45037,Arrowhead Lake at Edgefield county ,33.6236962376408,-81.8957140775735
SC,45003,Eggleston Lake at Aiken county ,33.6352354026689,-81.8626510767393
SC,45083,Qs/1 Fountain at Spartanburg county ,34.9501281041622,-81.9354404979484
SC,45043,Cokerville Lake at Georgetown county ,33.5732889827306,-79.4194574945985
SC,45063,Shulls Pond at Lexington county ,33.7434630543444,-81.3471408937221
SC,45063,Huffman Burnt Millpond at Lexington county ,33.7892151652666,-81.3432043272304
SC,45051,Smithfield Lake at Horry county ,33.7367345694375,-78.8386388291133
SC,45003,Lake Maxine at Aiken county ,33.5828085310641,-81.318772448686
SC,45003,Miller Pond at Aiken county ,33.5933105835478,-81.3142605377582
SC,45003,Clearwater Lake at Aiken county ,33.5065960196471,-81.8945835788808
SC,45063,Beauclaire Pond at Lexington county ,33.9951687423033,-81.2876353314285
SC,45087,Poplar Lake at Union county ,34.7512610808169,-81.6207285652878
SC,45013,Harbour Town Marina at Beaufort county ,32.1380233669458,-80.8122747027802
SC,45013,Braddock Cove at Beaufort county ,32.1173514029417,-80.8233625255157
SC,45003,Anderson Millpond at Aiken county ,33.457739754702,-81.7321772983028
SC,45013,Mill Creek Lake at Beaufort county ,32.2593358109185,-80.968894410335
SC,45011,Par Pond at Barnwell county ,33.2506657364241,-81.5278809786695
SC,45079,Elders Pond at Richland county ,34.147127823419,-80.9078145644859
SC,45083,Cleveland Park Lake at Spartanburg county ,34.9667569823309,-81.9511565082808
SC,45079,Coopers Lake at Richland county ,34.1173259816916,-80.8331931167085
SC,45079,Hunters Pond at Richland county ,34.1474197698032,-80.8826622060581
SC,45031,Harolds Mill Pond at Darlington county ,34.2655190089696,-80.0881164615286
SC,45013,Ibis Pond at Beaufort county ,32.2426875862129,-80.7752382136447
SC,45079,Entrance Lake at Richland county ,34.1018420046537,-80.9174378309481
SC,45013,Osprey Pond at Beaufort county ,32.2451447954418,-80.7660249142329
SC,45079,Roberts Pond at Richland county ,34.1447480056325,-80.9561889443035
SC,45003,Yonce Millpond at Aiken county ,33.7520361323808,-81.7098732045321
SC,45057,Coates Pond at Lancaster county ,34.4876090547981,-80.628610075777
SC,45075,Etheredge Millpond at Orangeburg county ,33.6317446227538,-81.0516969073875
SC,45019,Eastlake at Charleston county ,32.8165718620129,-79.8761819495088
SC,45019,Westlake at Charleston county ,32.8174006979027,-79.8788734723675
SC,45019,The Rookery at Charleston county ,32.814003811011,-79.8786456347701
SC,45079,Bruners Pond at Richland county ,34.0984115043371,-80.9382419944085
SC,45079,Barnnets Pond at Richland county ,34.1891983361739,-80.955640400745
SC,45013,Baynard Cove at Beaufort county ,32.1268472258339,-80.8304097427613
SC,45017,D H Rast House Pond at Calhoun county ,33.5704232626015,-80.619061246075
SC,45017,D H Rast Lower Pond at Calhoun county ,33.56697215287,-80.6180373569169
SC,45083,Lake Emory at Spartanburg county ,35.0378185221716,-82.0634819276803
SC,45017,Staley Pond at Calhoun county ,33.6601742084282,-80.9265446806234
SC,45017,Griffith Pond at Calhoun county ,33.6682932434551,-80.8354542162408
SC,45079,Lake Katherine at Richland county ,34.00252389756,-80.9644674046333
SC,45075,Fridays Pond at Orangeburg county ,33.6307247660012,-81.1204823195351
SC,45013,Lake Lombard at Beaufort county ,32.2555827470295,-80.9780467670011
SC,45075,Shuller Pond at Orangeburg county ,33.5123164416682,-80.7036878834108
SC,45075,Bulls Pond Dam D-3774 at Orangeburg county ,33.4409166254191,-80.5487269255545
SC,45003,Williamson Lake at Aiken county ,33.4709893727262,-81.7216625581022
SC,45017,Smoke Pond at Calhoun county ,33.648078443907,-80.7682590774641
SC,45017,Harmond Pond at Calhoun county ,33.5424683739317,-80.6747088151251
SC,45063,Eden Pond at Lexington county ,33.9364450353016,-81.2180978722664
SC,45063,Arrants Pond at Lexington county ,33.9195974792244,-81.2381480746225
SC,45063,Saxe-Gotha MillPond at Lexington county ,33.935745041746,-81.2421541394528
SC,45063,Lawn Pond at Lexington county ,33.9384710616765,-81.1879469906875
SC,45063,Sherman Pond at Lexington county ,33.9501798764311,-81.1934157296513
SC,45063,Martin Pond at Lexington county ,33.9871143396833,-81.12935896466
SC,45063,Graves Pond at Lexington county ,33.9866291122573,-81.1142196497154
SC,45063,Summer Lake at Lexington county ,34.0048304370989,-81.3223328383954
SC,45063,Younginer Pond at Lexington county ,33.904602257527,-81.2764370292704
SC,45063,Guignard Pond at Lexington county ,33.8683654907306,-81.1655135937666
SC,45063,Roof Pond at Lexington county ,33.9543529762478,-81.1535473570014
SC,45073,BoJangles Pond at Oconee county ,34.7598491627414,-83.0543247330054
SC,45073,123 Pond at Oconee county ,34.6990209271122,-82.9300572422669
SC,45003,Neeses Lake at Aiken county ,33.5887712443052,-81.5107730112211
SC,45003,Upper Pond at Aiken county ,33.6006916338657,-81.5058370953244
SC,45063,Staten Pond at Lexington county ,33.9166759842608,-81.0796066789918
SC,45063,Redmonds Pond at Lexington county ,33.8857066714547,-81.2495861641831
SC,45063,Bachman Ponds at Lexington county ,33.8753839776112,-81.2636270630577
SC,45063,Batesburg Reservoir at Lexington county ,33.8960849327464,-81.5288528008635
SC,45063,Millers Pond at Lexington county ,33.9095507573679,-81.3368220502853
SC,45063,Oswalds Pond at Lexington county ,33.8980855542336,-81.3941117331219
SC,45063,Kyser Pond at Lexington county ,33.8745807929723,-81.3094658882632
SC,45063,State-Record Pond at Lexington county ,33.8467347677361,-81.0653883398233
SC,45063,Lexington Acres Pond at Lexington county ,33.8446889208004,-81.0525581205263
SC,45063,Dixon Pond at Lexington county ,33.8380747991927,-81.0446677587425
SC,45063,Urquhart Pond at Lexington county ,33.8477930438837,-81.1253171388532
SC,45063,Lake Durham at Lexington county ,33.9169145441978,-81.1716075976567
SC,45063,Pitts Lake at Lexington county ,33.9343265519862,-81.1293144332628
SC,45063,Crystal Springs Lake at Lexington county ,33.8353759780571,-81.2352533406689
SC,45063,Paxton Millpond at Lexington county ,33.8603080726687,-81.346080192212
SC,45063,Fort Pond at Lexington county ,33.7626740535472,-81.2387835333221
SC,45063,Steedman Pond at Lexington county ,33.7865765988641,-81.4368711558627
SC,45063,Brooker Millpond at Lexington county ,33.7351309016348,-81.1093838984681
SC,45063,Huckabees Millpond at Lexington county ,33.7959474492472,-81.0494598569944
SC,45063,Armour Pond at Lexington county ,33.9076821114324,-81.1462249308281
SC,45079,Morrells Pond at Richland county ,33.9560964313946,-80.8291025194789
SC,45079,Haithcock Pond at Richland county ,33.9612685296313,-80.757656665486
SC,45079,Keels Lake at Richland county ,34.1568223561114,-81.0304806845331
SC,45079,Winters Pond at Richland county ,34.0737762595007,-81.0584823784084
SC,45079,Drafts Pond at Richland county ,33.8270505207115,-80.7282416052847
SC,45063,Sharpes Pond at Lexington county ,33.7498270209307,-81.1227971199839
